sch/v7.json
{"i": [["[\"3263325a80ce10494150f99e1172e661\", 2, 768, 1, 128, 1, 128, 768, 2, 768]", "cuda -keys=cuda,gpu -max_num_threads=1024 -thread_warp_size=32", [-1, 16, 64, 49152, 2147483647, 1024, 8, 32], "", 0, []], [[], [["FU", 8, [2, 3]], ["SP", 9, 1, 768, [2], 1], ["AN", 9, 2, 6], ["FSP", 8, 2, 1, 1], ["AN", 8, 3, 6], ["CA", 8, 9, 1], ["CI", 7], ["CI", 5], ["CI", 4], ["CI", 2], ["FU", 9, [0, 1]], ["AN", 9, 0, 5], ["PR", 8, 0, "auto_unroll_max_step$64"]]]], "r": [[5.72544e-06], 0, 1.87124, 1619647795], "v": "v0.6"}
{"i": [["[\"3263325a80ce10494150f99e1172e661\", 2, 768, 4, 128, 4, 128, 768, 2, 768]", "cuda -keys=cuda,gpu -max_num_threads=1024 -thread_warp_size=32", [-1, 16, 64, 49152, 2147483647, 1024, 8, 32], "", 0, []], [[], [["FU", 8, [2, 3]], ["SP", 9, 1, 768, [8], 1], ["AN", 9, 2, 6], ["FSP", 8, 2, 1, 1], ["AN", 8, 3, 6], ["CA", 8, 9, 1], ["CI", 7], ["CI", 5], ["CI", 4], ["CI", 2], ["FU", 9, [0, 1]], ["AN", 9, 0, 5], ["PR", 8, 0, "auto_unroll_max_step$512"]]]], "r": [[1.20362e-05], 0, 2.24033, 1619648458], "v": "v0.6"}
{"i": [["[\"3263325a80ce10494150f99e1172e661\", 2, 768, 8, 128, 8, 128, 768, 2, 768]", "cuda -keys=cuda,gpu -max_num_threads=1024 -thread_warp_size=32", [-1, 16, 64, 49152, 2147483647, 1024, 8, 32], "", 0, []], [[], [["FU", 8, [2, 3]], ["SP", 9, 1, 768, [12], 1], ["AN", 9, 2, 6], ["FSP", 8, 2, 1, 1], ["AN", 8, 3, 6], ["CA", 8, 9, 1], ["CI", 7], ["CI", 5], ["CI", 4], ["CI", 2], ["FU", 9, [0, 1]], ["AN", 9, 0, 5], ["PR", 8, 0, "auto_unroll_max_step$512"]]]], "r": [[2.26024e-05], 0, 2.3801, 1619649216], "v": "v0.6"}
{"i": [["[\"3263325a80ce10494150f99e1172e661\", 2, 768, 16, 128, 16, 128, 768, 2, 768]", "cuda -keys=cuda,gpu -max_num_threads=1024 -thread_warp_size=32", [-1, 16, 64, 49152, 2147483647, 1024, 8, 32], "", 0, []], [[], [["FU", 8, [2, 3]], ["SP", 9, 1, 768, [24], 1], ["AN", 9, 2, 6], ["FSP", 8, 2, 1, 1], ["AN", 8, 3, 6], ["CA", 8, 9, 1], ["CI", 7], ["CI", 5], ["CI", 4], ["CI", 2], ["FU", 9, [0, 1]], ["AN", 9, 0, 5], ["PR", 8, 0, "auto_unroll_max_step$1024"]]]], "r": [[6.07885e-05], 0, 2.27219, 1619649978], "v": "v0.6"}
{"i": [["[\"3263325a80ce10494150f99e1172e661\", 2, 768, 32, 128, 32, 128, 768, 2, 768]", "cuda -keys=cuda,gpu -max_num_threads=1024 -thread_warp_size=32", [-1, 16, 64, 49152, 2147483647, 1024, 8, 32], "", 0, []], [[], [["CI", 7], ["CI", 5], ["CI", 4], ["CI", 2], ["FU", 9, [0, 1]], ["SP", 9, 0, 1536, [64], 1], ["AN", 9, 0, 5], ["AN", 9, 1, 6], ["FU", 8, [0, 1]], ["SP", 8, 0, 1536, [8], 1], ["AN", 8, 0, 5], ["AN", 8, 1, 6], ["PR", 8, 0, "auto_unroll_max_step$16"]]]], "r": [[0.000240783], 0, 2.18024, 1619650993], "v": "v0.6"}
{"i": [["[\"3263325a80ce10494150f99e1172e661\", 2, 768, 64, 128, 64, 128, 768, 2, 768]", "cuda -keys=cuda,gpu -max_num_threads=1024 -thread_warp_size=32", [-1, 16, 64, 49152, 2147483647, 1024, 8, 32], "", 0, []], [[], [["CI", 7], ["CI", 5], ["CI", 4], ["CI", 2], ["FU", 9, [0, 1]], ["SP", 9, 0, 1536, [32], 1], ["AN", 9, 0, 5], ["AN", 9, 1, 6], ["FU", 8, [0, 1]], ["SP", 8, 0, 1536, [8], 1], ["AN", 8, 0, 5], ["AN", 8, 1, 6], ["PR", 8, 0, "auto_unroll_max_step$512"]]]], "r": [[0.000452315], 0, 3.44125, 1623892542], "v": "v0.6"}
{"i": [["[\"19b483cb8cd401d9b3701cf255ce9355\", 512, 768, 1, 128, 1, 128, 768, 512, 768]", "cuda -keys=cuda,gpu -max_num_threads=1024 -thread_warp_size=32", [-1, 16, 64, 49152, 2147483647, 1024, 8, 32], "", 0, []], [[], [["FU", 8, [2, 3]], ["SP", 9, 1, 768, [32], 1], ["AN", 9, 2, 6], ["FSP", 8, 2, 1, 1], ["AN", 8, 3, 6], ["CA", 8, 9, 1], ["CI", 7], ["CI", 5], ["CI", 4], ["CI", 2], ["FU", 9, [0, 1]], ["AN", 9, 0, 5], ["PR", 8, 0, "auto_unroll_max_step$0"]]]], "r": [[4.60477e-05], 0, 2.53882, 1623892884], "v": "v0.6"}
{"i": [["[\"19b483cb8cd401d9b3701cf255ce9355\", 512, 768, 4, 128, 4, 128, 768, 512, 768]", "cuda -keys=cuda,gpu -max_num_threads=1024 -thread_warp_size=32", [-1, 16, 64, 49152, 2147483647, 1024, 8, 32], "", 0, []], [[], [["FU", 8, [2, 3]], ["SP", 9, 1, 768, [32], 1], ["AN", 9, 2, 6], ["FSP", 8, 2, 1, 1], ["AN", 8, 3, 6], ["CA", 8, 9, 1], ["CI", 7], ["CI", 5], ["CI", 4], ["CI", 2], ["FU", 9, [0, 1]], ["AN", 9, 0, 5], ["PR", 8, 0, "auto_unroll_max_step$64"]]]], "r": [[0.000131696], 0, 1.92443, 1619648612], "v": "v0.6"}
{"i": [["[\"19b483cb8cd401d9b3701cf255ce9355\", 512, 768, 8, 128, 8, 128, 768, 512, 768]", "cuda -keys=cuda,gpu -max_num_threads=1024 -thread_warp_size=32", [-1, 16, 64, 49152, 2147483647, 1024, 8, 32], "", 0, []], [[], [["FU", 8, [2, 3]], ["SP", 9, 1, 768, [32], 1], ["AN", 9, 2, 6], ["FSP", 8, 2, 1, 1], ["AN", 8, 3, 6], ["CA", 8, 9, 1], ["CI", 7], ["CI", 5], ["CI", 4], ["CI", 2], ["FU", 9, [0, 1]], ["AN", 9, 0, 5], ["PR", 8, 0, "auto_unroll_max_step$64"]]]], "r": [[0.000247524], 0, 1.97858, 1619649363], "v": "v0.6"}
{"i": [["[\"19b483cb8cd401d9b3701cf255ce9355\", 512, 768, 16, 128, 16, 128, 768, 512, 768]", "cuda -keys=cuda,gpu -max_num_threads=1024 -thread_warp_size=32", [-1, 16, 64, 49152, 2147483647, 1024, 8, 32], "", 0, []], [[], [["FU", 8, [2, 3]], ["SP", 9, 1, 768, [32], 1], ["AN", 9, 2, 6], ["FSP", 8, 2, 1, 1], ["AN", 8, 3, 6], ["CA", 8, 9, 1], ["CI", 7], ["CI", 5], ["CI", 4], ["CI", 2], ["FU", 9, [0, 1]], ["AN", 9, 0, 5], ["PR", 8, 0, "auto_unroll_max_step$512"]]]], "r": [[0.000513133], 0, 1.81205, 1619650141], "v": "v0.6"}
{"i": [["[\"19b483cb8cd401d9b3701cf255ce9355\", 512, 768, 32, 128, 32, 128, 768, 512, 768]", "cuda -keys=cuda,gpu -max_num_threads=1024 -thread_warp_size=32", [-1, 16, 64, 49152, 2147483647, 1024, 8, 32], "", 0, []], [[], [["FU", 8, [2, 3]], ["SP", 9, 1, 768, [32], 1], ["AN", 9, 2, 6], ["FSP", 8, 2, 1, 1], ["AN", 8, 3, 6], ["CA", 8, 9, 1], ["CI", 7], ["CI", 5], ["CI", 4], ["CI", 2], ["FU", 9, [0, 1]], ["AN", 9, 0, 5], ["PR", 8, 0, "auto_unroll_max_step$512"]]]], "r": [[0.00119394], 0, 2.46667, 1619651144], "v": "v0.6"}
{"i": [["[\"19b483cb8cd401d9b3701cf255ce9355\", 512, 768, 64, 128, 64, 128, 768, 512, 768]", "cuda -keys=cuda,gpu -max_num_threads=1024 -thread_warp_size=32", [-1, 16, 64, 49152, 2147483647, 1024, 8, 32], "", 0, []], [[], [["CI", 7], ["CI", 5], ["CI", 4], ["CI", 2], ["FU", 9, [0, 1]], ["SP", 9, 0, 393216, [64], 1], ["AN", 9, 0, 5], ["AN", 9, 1, 6], ["FU", 8, [0, 1]], ["SP", 8, 0, 393216, [64], 1], ["AN", 8, 0, 5], ["AN", 8, 1, 6], ["PR", 8, 0, "auto_unroll_max_step$512"]]]], "r": [[0.0034953], 0, 2.22951, 1619652193], "v": "v0.6"}
{"i": [["[\"6f8cd064ed6ec8c4859721e2f9a46b65\", 1024, 768, 1, 128, 1, 128, 768, 1024, 768]", "cuda -keys=cuda,gpu -max_num_threads=1024 -thread_warp_size=32", [-1, 16, 64, 49152, 2147483647, 1024, 8, 32], "", 0, []], [[], [["FU", 8, [2, 3]], ["SP", 9, 1, 768, [32], 1], ["AN", 9, 2, 6], ["FSP", 8, 2, 1, 1], ["AN", 8, 3, 6], ["CA", 8, 9, 1], ["CI", 7], ["CI", 5], ["CI", 4], ["CI", 2], ["FU", 9, [0, 1]], ["AN", 9, 0, 5], ["PR", 8, 0, "auto_unroll_max_step$0"]]]], "r": [[8.51095e-05], 0, 2.12938, 1619648003], "v": "v0.6"}
{"i": [["[\"6f8cd064ed6ec8c4859721e2f9a46b65\", 1024, 768, 4, 128, 4, 128, 768, 1024, 768]", "cuda -keys=cuda,gpu -max_num_threads=1024 -thread_warp_size=32", [-1, 16, 64, 49152, 2147483647, 1024, 8, 32], "", 0, []], [[], [["FU", 8, [2, 3]], ["SP", 9, 1, 768, [32], 1], ["AN", 9, 2, 6], ["FSP", 8, 2, 1, 1], ["AN", 8, 3, 6], ["CA", 8, 9, 1], ["CI", 7], ["CI", 5], ["CI", 4], ["CI", 2], ["FU", 9, [0, 1]], ["AN", 9, 0, 5], ["PR", 8, 0, "auto_unroll_max_step$64"]]]], "r": [[0.000221752], 0, 2.04687, 1619648728], "v": "v0.6"}
{"i": [["[\"6f8cd064ed6ec8c4859721e2f9a46b65\", 1024, 768, 8, 128, 8, 128, 768, 1024, 768]", "cuda -keys=cuda,gpu -max_num_threads=1024 -thread_warp_size=32", [-1, 16, 64, 49152, 2147483647, 1024, 8, 32], "", 0, []], [[], [["FU", 8, [2, 3]], ["SP", 9, 1, 768, [32], 1], ["AN", 9, 2, 6], ["FSP", 8, 2, 1, 1], ["AN", 8, 3, 6], ["CA", 8, 9, 1], ["CI", 7], ["CI", 5], ["CI", 4], ["CI", 2], ["FU", 9, [0, 1]], ["AN", 9, 0, 5], ["PR", 8, 0, "auto_unroll_max_step$1024"]]]], "r": [[0.000404567], 0, 1.55276, 1619649471], "v": "v0.6"}
{"i": [["[\"6f8cd064ed6ec8c4859721e2f9a46b65\", 1024, 768, 16, 128, 16, 128, 768, 1024, 768]", "cuda -keys=cuda,gpu -max_num_threads=1024 -thread_warp_size=32", [-1, 16, 64, 49152, 2147483647, 1024, 8, 32], "", 0, []], [[], [["FU", 8, [2, 3]], ["SP", 9, 1, 768, [32], 1], ["AN", 9, 2, 6], ["FSP", 8, 2, 1, 1], ["AN", 8, 3, 6], ["CA", 8, 9, 1], ["CI", 7], ["CI", 5], ["CI", 4], ["CI", 2], ["FU", 9, [0, 1]], ["AN", 9, 0, 5], ["PR", 8, 0, "auto_unroll_max_step$1024"]]]], "r": [[0.000790186], 0, 2.3029, 1619650305], "v": "v0.6"}
{"i": [["[\"6f8cd064ed6ec8c4859721e2f9a46b65\", 1024, 768, 32, 128, 32, 128, 768, 1024, 768]", "cuda -keys=cuda,gpu -max_num_threads=1024 -thread_warp_size=32", [-1, 16, 64, 49152, 2147483647, 1024, 8, 32], "", 0, []], [[], [["FU", 8, [2, 3]], ["SP", 9, 1, 768, [32], 1], ["AN", 9, 2, 6], ["FSP", 8, 2, 1, 1], ["AN", 8, 3, 6], ["CA", 8, 9, 1], ["CI", 7], ["CI", 5], ["CI", 4], ["CI", 2], ["FU", 9, [0, 1]], ["AN", 9, 0, 5], ["PR", 8, 0, "auto_unroll_max_step$512"]]]], "r": [[0.00195768], 0, 1.97227, 1619651217], "v": "v0.6"}
{"i": [["[\"6f8cd064ed6ec8c4859721e2f9a46b65\", 1024, 768, 64, 128, 64, 128, 768, 1024, 768]", "cuda -keys=cuda,gpu -max_num_threads=1024 -thread_warp_size=32", [-1, 16, 64, 49152, 2147483647, 1024, 8, 32], "", 0, []], [[], [["FU", 8, [2, 3]], ["SP", 9, 1, 768, [32], 1], ["AN", 9, 2, 6], ["FSP", 8, 2, 1, 1], ["AN", 8, 3, 6], ["CA", 8, 9, 1], ["CI", 7], ["CI", 5], ["CI", 4], ["CI", 2], ["FU", 9, [0, 1]], ["AN", 9, 0, 5], ["PR", 8, 0, "auto_unroll_max_step$512"]]]], "r": [[0.00624801], 0, 3.43426, 1619652341], "v": "v0.6"}
{"i": [["[\"76f6c94a32038e92942fc95414b9538a\", 30522, 768, 1, 128, 1, 128, 768, 30522, 768]", "cuda -keys=cuda,gpu -max_num_threads=1024 -thread_warp_size=32", [-1, 16, 64, 49152, 2147483647, 1024, 8, 32], "", 0, []], [[], [["FU", 8, [2, 3]], ["SP", 9, 1, 768, [32], 1], ["AN", 9, 2, 6], ["FSP", 8, 2, 1, 1], ["AN", 8, 3, 6], ["CA", 8, 9, 1], ["CI", 7], ["CI", 5], ["CI", 4], ["CI", 2], ["FU", 9, [0, 1]], ["AN", 9, 0, 5], ["PR", 8, 0, "auto_unroll_max_step$64"]]]], "r": [[0.00224136], 0, 2.54064, 1619648176], "v": "v0.6"}
{"i": [["[\"76f6c94a32038e92942fc95414b9538a\", 30522, 768, 4, 128, 4, 128, 768, 30522, 768]", "cuda -keys=cuda,gpu -max_num_threads=1024 -thread_warp_size=32", [-1, 16, 64, 49152, 2147483647, 1024, 8, 32], "", 0, []], [[], [["FU", 8, [2, 3]], ["SP", 9, 1, 768, [32], 1], ["AN", 9, 2, 6], ["FSP", 8, 2, 1, 1], ["AN", 8, 3, 6], ["CA", 8, 9, 1], ["CI", 7], ["CI", 5], ["CI", 4], ["CI", 2], ["FU", 9, [0, 1]], ["AN", 9, 0, 5], ["PR", 8, 0, "auto_unroll_max_step$512"]]]], "r": [[0.00498894], 0, 2.48103, 1619648879], "v": "v0.6"}
{"i": [["[\"76f6c94a32038e92942fc95414b9538a\", 30522, 768, 8, 128, 8, 128, 768, 30522, 768]", "cuda -keys=cuda,gpu -max_num_threads=1024 -thread_warp_size=32", [-1, 16, 64, 49152, 2147483647, 1024, 8, 32], "", 0, []], [[], [["FU", 8, [2, 3]], ["SP", 9, 1, 768, [32], 1], ["AN", 9, 2, 6], ["FSP", 8, 2, 1, 1], ["AN", 8, 3, 6], ["CA", 8, 9, 1], ["CI", 7], ["CI", 5], ["CI", 4], ["CI", 2], ["FU", 9, [0, 1]], ["AN", 9, 0, 5], ["PR", 8, 0, "auto_unroll_max_step$512"]]]], "r": [[0.0087595], 0, 2.62076, 1619649662], "v": "v0.6"}
{"i": [["[\"76f6c94a32038e92942fc95414b9538a\", 30522, 768, 16, 128, 16, 128, 768, 30522, 768]", "cuda -keys=cuda,gpu -max_num_threads=1024 -thread_warp_size=32", [-1, 16, 64, 49152, 2147483647, 1024, 8, 32], "", 0, []], [[], [["FU", 8, [2, 3]], ["SP", 9, 1, 768, [32], 1], ["AN", 9, 2, 6], ["FSP", 8, 2, 1, 1], ["AN", 8, 3, 6], ["CA", 8, 9, 1], ["CI", 7], ["CI", 5], ["CI", 4], ["CI", 2], ["FU", 9, [0, 1]], ["AN", 9, 0, 5], ["PR", 8, 0, "auto_unroll_max_step$1024"]]]], "r": [[0.0166692], 0, 2.68616, 1619650556], "v": "v0.6"}
{"i": [["[\"76f6c94a32038e92942fc95414b9538a\", 30522, 768, 32, 128, 32, 128, 768, 30522, 768]", "cuda -keys=cuda,gpu -max_num_threads=1024 -thread_warp_size=32", [-1, 16, 64, 49152, 2147483647, 1024, 8, 32], "", 0, []], [[], [["FU", 8, [2, 3]], ["SP", 9, 1, 768, [32], 1], ["AN", 9, 2, 6], ["FSP", 8, 2, 1, 1], ["AN", 8, 3, 6], ["CA", 8, 9, 1], ["CI", 7], ["CI", 5], ["CI", 4], ["CI", 2], ["FU", 9, [0, 1]], ["AN", 9, 0, 5], ["PR", 8, 0, "auto_unroll_max_step$1024"]]]], "r": [[0.042539], 0, 3.00405, 1619651571], "v": "v0.6"}
{"i": [["[\"76f6c94a32038e92942fc95414b9538a\", 30522, 768, 64, 128, 64, 128, 768, 30522, 768]", "cuda -keys=cuda,gpu -max_num_threads=1024 -thread_warp_size=32", [-1, 16, 64, 49152, 2147483647, 1024, 8, 32], "", 0, []], [[], [["CI", 7], ["CI", 5], ["CI", 4], ["CI", 2], ["FU", 9, [0, 1]], ["SP", 9, 0, 23440896, [64], 1], ["AN", 9, 0, 5], ["AN", 9, 1, 6], ["FU", 8, [0, 1]], ["SP", 8, 0, 23440896, [64], 1], ["AN", 8, 0, 5], ["AN", 8, 1, 6], ["PR", 8, 0, "auto_unroll_max_step$16"]]]], "r": [[0.145994], 0, 4.17617, 1623893345], "v": "v0.6"}
{"i": [["[\"e4cf622518e93f97eea1251eaa569075\", 50257, 768, 1, 128, 1, 128, 768, 50257, 768]", "cuda -keys=cuda,gpu -max_num_threads=1024 -thread_warp_size=32", [-1, 16, 64, 49152, 2147483647, 1024, 8, 32], "", 0, []], [[], [["FU", 8, [2, 3]], ["SP", 9, 1, 768, [32], 1], ["AN", 9, 2, 6], ["FSP", 8, 2, 1, 1], ["AN", 8, 3, 6], ["CA", 8, 9, 1], ["CI", 7], ["CI", 5], ["CI", 4], ["CI", 2], ["FU", 9, [0, 1]], ["AN", 9, 0, 5], ["PR", 8, 0, "auto_unroll_max_step$64"]]]], "r": [[0.00368507], 0, 3.12804, 1619648244], "v": "v0.6"}
{"i": [["[\"e4cf622518e93f97eea1251eaa569075\", 50257, 768, 4, 128, 4, 128, 768, 50257, 768]", "cuda -keys=cuda,gpu -max_num_threads=1024 -thread_warp_size=32", [-1, 16, 64, 49152, 2147483647, 1024, 8, 32], "", 0, []], [[], [["FU", 8, [2, 3]], ["SP", 9, 1, 768, [32], 1], ["AN", 9, 2, 6], ["FSP", 8, 2, 1, 1], ["AN", 8, 3, 6], ["CA", 8, 9, 1], ["CI", 7], ["CI", 5], ["CI", 4], ["CI", 2], ["FU", 9, [0, 1]], ["AN", 9, 0, 5], ["PR", 8, 0, "auto_unroll_max_step$512"]]]], "r": [[0.00816839], 0, 3.21431, 1619649116], "v": "v0.6"}
{"i": [["[\"e4cf622518e93f97eea1251eaa569075\", 50257, 768, 8, 128, 8, 128, 768, 50257, 768]", "cuda -keys=cuda,gpu -max_num_threads=1024 -thread_warp_size=32", [-1, 16, 64, 49152, 2147483647, 1024, 8, 32], "", 0, []], [[], [["FU", 8, [2, 3]], ["SP", 9, 1, 768, [32], 1], ["AN", 9, 2, 6], ["FSP", 8, 2, 1, 1], ["AN", 8, 3, 6], ["CA", 8, 9, 1], ["CI", 7], ["CI", 5], ["CI", 4], ["CI", 2], ["FU", 9, [0, 1]], ["AN", 9, 0, 5], ["PR", 8, 0, "auto_unroll_max_step$1024"]]]], "r": [[0.014365], 0, 3.38538, 1619649767], "v": "v0.6"}
{"i": [["[\"e4cf622518e93f97eea1251eaa569075\", 50257, 768, 16, 128, 16, 128, 768, 50257, 768]", "cuda -keys=cuda,gpu -max_num_threads=1024 -thread_warp_size=32", [-1, 16, 64, 49152, 2147483647, 1024, 8, 32], "", 0, []], [[], [["FU", 8, [2, 3]], ["SP", 9, 1, 768, [32], 1], ["AN", 9, 2, 6], ["FSP", 8, 2, 1, 1], ["AN", 8, 3, 6], ["CA", 8, 9, 1], ["CI", 7], ["CI", 5], ["CI", 4], ["CI", 2], ["FU", 9, [0, 1]], ["AN", 9, 0, 5], ["PR", 8, 0, "auto_unroll_max_step$1024"]]]], "r": [[0.0273033], 0, 3.60947, 1619650619], "v": "v0.6"}
{"i": [["[\"e4cf622518e93f97eea1251eaa569075\", 50257, 768, 32, 128, 32, 128, 768, 50257, 768]", "cuda -keys=cuda,gpu -max_num_threads=1024 -thread_warp_size=32", [-1, 16, 64, 49152, 2147483647, 1024, 8, 32], "", 0, []], [[], [["FU", 8, [2, 3]], ["SP", 9, 1, 768, [32], 1], ["AN", 9, 2, 6], ["FSP", 8, 2, 1, 1], ["AN", 8, 3, 6], ["CA", 8, 9, 1], ["CI", 7], ["CI", 5], ["CI", 4], ["CI", 2], ["FU", 9, [0, 1]], ["AN", 9, 0, 5], ["PR", 8, 0, "auto_unroll_max_step$1024"]]]], "r": [[0.0696815], 0, 4.08953, 1619654480], "v": "v0.6"}
{"i": [["[\"e4cf622518e93f97eea1251eaa569075\", 50257, 768, 64, 128, 64, 128, 768, 50257, 768]", "cuda -keys=cuda,gpu -max_num_threads=1024 -thread_warp_size=32", [-1, 16, 64, 49152, 2147483647, 1024, 8, 32], "", 0, []], [[], [["FU", 8, [2, 3]], ["SP", 9, 1, 768, [32], 1], ["AN", 9, 2, 6], ["FSP", 8, 2, 1, 1], ["AN", 8, 3, 6], ["CA", 8, 9, 1], ["CI", 7], ["CI", 5], ["CI", 4], ["CI", 2], ["FU", 9, [0, 1]], ["AN", 9, 0, 5], ["PR", 8, 0, "auto_unroll_max_step$1024"]]]], "r": [[0.23946], 0, 4.84868, 1619653148], "v": "v0.6"}
{"i": [["[\"c46fc1c2acafd210f273fb828f4293bf\", 1, 128, 1, 128, 768, 2, 768]", "cuda -keys=cuda,gpu -max_num_threads=1024 -thread_warp_size=32", [-1, 16, 64, 49152, 2147483647, 1024, 8, 32], "", 0, []], [[], [["FU", 5, [2, 3]], ["SP", 5, 2, 128, [32], 1], ["AN", 5, 3, 6], ["CI", 4], ["CI", 2], ["CI", 1], ["FU", 5, [0, 1]], ["AN", 5, 0, 5], ["PR", 5, 0, "auto_unroll_max_step$64"]]]], "r": [[4.99796e-06], 0, 1.65562, 1619654814], "v": "v0.6"}
{"i": [["[\"c46fc1c2acafd210f273fb828f4293bf\", 4, 128, 4, 128, 768, 2, 768]", "cuda -keys=cuda,gpu -max_num_threads=1024 -thread_warp_size=32", [-1, 16, 64, 49152, 2147483647, 1024, 8, 32], "", 0, []], [[], [["FU", 5, [2, 3]], ["SP", 5, 2, 512, [8], 1], ["AN", 5, 3, 6], ["CI", 4], ["CI", 2], ["CI", 1], ["FU", 5, [0, 1]], ["AN", 5, 0, 5], ["PR", 5, 0, "auto_unroll_max_step$16"]]]], "r": [[1.02054e-05], 0, 1.90748, 1619655382], "v": "v0.6"}
{"i": [["[\"c46fc1c2acafd210f273fb828f4293bf\", 8, 128, 8, 128, 768, 2, 768]", "cuda -keys=cuda,gpu -max_num_threads=1024 -thread_warp_size=32", [-1, 16, 64, 49152, 2147483647, 1024, 8, 32], "", 0, []], [[], [["FU", 5, [2, 3]], ["SP", 5, 2, 1024, [32], 1], ["AN", 5, 3, 6], ["CI", 4], ["CI", 2], ["CI", 1], ["FU", 5, [0, 1]], ["AN", 5, 0, 5], ["PR", 5, 0, "auto_unroll_max_step$0"]]]], "r": [[1.65151e-05], 0, 1.87675, 1619656026], "v": "v0.6"}
{"i": [["[\"c46fc1c2acafd210f273fb828f4293bf\", 16, 128, 16, 128, 768, 2, 768]", "cuda -keys=cuda,gpu -max_num_threads=1024 -thread_warp_size=32", [-1, 16, 64, 49152, 2147483647, 1024, 8, 32], "", 0, []], [[], [["FU", 5, [2, 3]], ["SP", 5, 2, 2048, [16], 1], ["AN", 5, 3, 6], ["CI", 4], ["CI", 2], ["CI", 1], ["FU", 5, [0, 1]], ["AN", 5, 0, 5], ["PR", 5, 0, "auto_unroll_max_step$512"]]]], "r": [[3.02286e-05], 0, 2.08708, 1619656693], "v": "v0.6"}
{"i": [["[\"c46fc1c2acafd210f273fb828f4293bf\", 32, 128, 32, 128, 768, 2, 768]", "cuda -keys=cuda,gpu -max_num_threads=1024 -thread_warp_size=32", [-1, 16, 64, 49152, 2147483647, 1024, 8, 32], "", 0, []], [[], [["FU", 5, [2, 3]], ["SP", 5, 2, 4096, [32], 1], ["AN", 5, 3, 6], ["CI", 4], ["CI", 2], ["CI", 1], ["FU", 5, [0, 1]], ["AN", 5, 0, 5], ["PR", 5, 0, "auto_unroll_max_step$1024"]]]], "r": [[5.74743e-05], 0, 2.09299, 1619657403], "v": "v0.6"}
{"i": [["[\"c46fc1c2acafd210f273fb828f4293bf\", 64, 128, 64, 128, 768, 2, 768]", "cuda -keys=cuda,gpu -max_num_threads=1024 -thread_warp_size=32", [-1, 16, 64, 49152, 2147483647, 1024, 8, 32], "", 0, []], [[], [["FU", 5, [2, 3]], ["SP", 5, 2, 8192, [32], 1], ["AN", 5, 3, 6], ["CI", 4], ["CI", 2], ["CI", 1], ["FU", 5, [0, 1]], ["AN", 5, 0, 5], ["PR", 5, 0, "auto_unroll_max_step$0"]]]], "r": [[0.000111383], 0, 2.20286, 1619658105], "v": "v0.6"}
{"i": [["[\"87206c83e78be1ce79038440368051e0\", 1, 128, 1, 128, 768, 512, 768]", "cuda -keys=cuda,gpu -max_num_threads=1024 -thread_warp_size=32", [-1, 16, 64, 49152, 2147483647, 1024, 8, 32], "", 0, []], [[], [["CI", 4], ["CI", 2], ["CI", 1], ["FU", 5, [0, 1]], ["SP", 5, 0, 393216, [64], 1], ["AN", 5, 0, 5], ["AN", 5, 1, 6], ["PR", 5, 0, "auto_unroll_max_step$1024"]]]], "r": [[4.57808e-05], 0, 2.09417, 1619654901], "v": "v0.6"}
{"i": [["[\"87206c83e78be1ce79038440368051e0\", 4, 128, 4, 128, 768, 512, 768]", "cuda -keys=cuda,gpu -max_num_threads=1024 -thread_warp_size=32", [-1, 16, 64, 49152, 2147483647, 1024, 8, 32], "", 0, []], [[], [["CI", 4], ["CI", 2], ["CI", 1], ["FU", 5, [0, 1]], ["SP", 5, 0, 393216, [64], 1], ["AN", 5, 0, 5], ["AN", 5, 1, 6], ["PR", 5, 0, "auto_unroll_max_step$16"]]]], "r": [[0.000209163], 0, 2.01983, 1619655468], "v": "v0.6"}
{"i": [["[\"87206c83e78be1ce79038440368051e0\", 8, 128, 8, 128, 768, 512, 768]", "cuda -keys=cuda,gpu -max_num_threads=1024 -thread_warp_size=32", [-1, 16, 64, 49152, 2147483647, 1024, 8, 32], "", 0, []], [[], [["CI", 4], ["CI", 2], ["CI", 1], ["FU", 5, [0, 1]], ["SP", 5, 0, 393216, [32], 1], ["AN", 5, 0, 5], ["AN", 5, 1, 6], ["PR", 5, 0, "auto_unroll_max_step$512"]]]], "r": [[0.000417474], 0, 2.1072, 1619656135], "v": "v0.6"}
{"i": [["[\"87206c83e78be1ce79038440368051e0\", 16, 128, 16, 128, 768, 512, 768]", "cuda -keys=cuda,gpu -max_num_threads=1024 -thread_warp_size=32", [-1, 16, 64, 49152, 2147483647, 1024, 8, 32], "", 0, []], [[], [["FU", 5, [2, 3]], ["SP", 5, 2, 2048, [64], 1], ["AN", 5, 3, 6], ["CI", 4], ["CI", 2], ["CI", 1], ["FU", 5, [0, 1]], ["AN", 5, 0, 5], ["PR", 5, 0, "auto_unroll_max_step$512"]]]], "r": [[0.000711315], 0, 2.13724, 1619656832], "v": "v0.6"}
{"i": [["[\"87206c83e78be1ce79038440368051e0\", 32, 128, 32, 128, 768, 512, 768]", "cuda -keys=cuda,gpu -max_num_threads=1024 -thread_warp_size=32", [-1, 16, 64, 49152, 2147483647, 1024, 8, 32], "", 0, []], [[], [["FU", 5, [2, 3]], ["SP", 5, 2, 4096, [64], 1], ["AN", 5, 3, 6], ["CI", 4], ["CI", 2], ["CI", 1], ["FU", 5, [0, 1]], ["AN", 5, 0, 5], ["PR", 5, 0, "auto_unroll_max_step$512"]]]], "r": [[0.00145064], 0, 2.17491, 1619657523], "v": "v0.6"}
{"i": [["[\"87206c83e78be1ce79038440368051e0\", 64, 128, 64, 128, 768, 512, 768]", "cuda -keys=cuda,gpu -max_num_threads=1024 -thread_warp_size=32", [-1, 16, 64, 49152, 2147483647, 1024, 8, 32], "", 0, []], [[], [["FU", 5, [2, 3]], ["SP", 5, 2, 8192, [64], 1], ["AN", 5, 3, 6], ["CI", 4], ["CI", 2], ["CI", 1], ["FU", 5, [0, 1]], ["AN", 5, 0, 5], ["PR", 5, 0, "auto_unroll_max_step$512"]]]], "r": [[0.00300084], 0, 1.59272, 1619658236], "v": "v0.6"}
{"i": [["[\"d3a78baaaa7553d1505276de288fedca\", 1, 128, 1, 128, 768, 1024, 768]", "cuda -keys=cuda,gpu -max_num_threads=1024 -thread_warp_size=32", [-1, 16, 64, 49152, 2147483647, 1024, 8, 32], "", 0, []], [[], [["CI", 4], ["CI", 2], ["CI", 1], ["FU", 5, [0, 1]], ["SP", 5, 0, 786432, [64], 1], ["AN", 5, 0, 5], ["AN", 5, 1, 6], ["PR", 5, 0, "auto_unroll_max_step$0"]]]], "r": [[8.62211e-05], 0, 2.07242, 1619654970], "v": "v0.6"}
{"i": [["[\"d3a78baaaa7553d1505276de288fedca\", 4, 128, 4, 128, 768, 1024, 768]", "cuda -keys=cuda,gpu -max_num_threads=1024 -thread_warp_size=32", [-1, 16, 64, 49152, 2147483647, 1024, 8, 32], "", 0, []], [[], [["CI", 4], ["CI", 2], ["CI", 1], ["FU", 5, [0, 1]], ["SP", 5, 0, 786432, [64], 1], ["AN", 5, 0, 5], ["AN", 5, 1, 6], ["PR", 5, 0, "auto_unroll_max_step$1024"]]]], "r": [[0.000404574], 0, 2.0523, 1619655623], "v": "v0.6"}
{"i": [["[\"d3a78baaaa7553d1505276de288fedca\", 8, 128, 8, 128, 768, 1024, 768]", "cuda -keys=cuda,gpu -max_num_threads=1024 -thread_warp_size=32", [-1, 16, 64, 49152, 2147483647, 1024, 8, 32], "", 0, []], [[], [["CI", 4], ["CI", 2], ["CI", 1], ["FU", 5, [0, 1]], ["SP", 5, 0, 786432, [64], 1], ["AN", 5, 0, 5], ["AN", 5, 1, 6], ["PR", 5, 0, "auto_unroll_max_step$1024"]]]], "r": [[0.000811316], 0, 2.16384, 1619656265], "v": "v0.6"}
{"i": [["[\"d3a78baaaa7553d1505276de288fedca\", 16, 128, 16, 128, 768, 1024, 768]", "cuda -keys=cuda,gpu -max_num_threads=1024 -thread_warp_size=32", [-1, 16, 64, 49152, 2147483647, 1024, 8, 32], "", 0, []], [[], [["FU", 5, [2, 3]], ["SP", 5, 2, 2048, [64], 1], ["AN", 5, 3, 6], ["CI", 4], ["CI", 2], ["CI", 1], ["FU", 5, [0, 1]], ["AN", 5, 0, 5], ["PR", 5, 0, "auto_unroll_max_step$64"]]]], "r": [[0.00139405], 0, 1.48881, 1619656945], "v": "v0.6"}
{"i": [["[\"d3a78baaaa7553d1505276de288fedca\", 32, 128, 32, 128, 768, 1024, 768]", "cuda -keys=cuda,gpu -max_num_threads=1024 -thread_warp_size=32", [-1, 16, 64, 49152, 2147483647, 1024, 8, 32], "", 0, []], [[], [["FU", 5, [2, 3]], ["SP", 5, 2, 4096, [64], 1], ["AN", 5, 3, 6], ["CI", 4], ["CI", 2], ["CI", 1], ["FU", 5, [0, 1]], ["AN", 5, 0, 5], ["PR", 5, 0, "auto_unroll_max_step$0"]]]], "r": [[0.00285299], 0, 1.52348, 1619657621], "v": "v0.6"}
{"i": [["[\"d3a78baaaa7553d1505276de288fedca\", 64, 128, 64, 128, 768, 1024, 768]", "cuda -keys=cuda,gpu -max_num_threads=1024 -thread_warp_size=32", [-1, 16, 64, 49152, 2147483647, 1024, 8, 32], "", 0, []], [[], [["FU", 5, [2, 3]], ["SP", 5, 2, 8192, [64], 1], ["AN", 5, 3, 6], ["CI", 4], ["CI", 2], ["CI", 1], ["FU", 5, [0, 1]], ["AN", 5, 0, 5], ["PR", 5, 0, "auto_unroll_max_step$512"]]]], "r": [[0.00579372], 0, 1.64031, 1619658336], "v": "v0.6"}
{"i": [["[\"06315d7bde65bf8117757861f6675111\", 1, 128, 1, 128, 768, 30522, 768]", "cuda -keys=cuda,gpu -max_num_threads=1024 -thread_warp_size=32", [-1, 16, 64, 49152, 2147483647, 1024, 8, 32], "", 0, []], [[], [["CI", 4], ["CI", 2], ["CI", 1], ["FU", 5, [0, 1]], ["SP", 5, 0, 23440896, [64], 1], ["AN", 5, 0, 5], ["AN", 5, 1, 6], ["PR", 5, 0, "auto_unroll_max_step$16"]]]], "r": [[0.00242653], 0, 1.95656, 1619655078], "v": "v0.6"}
{"i": [["[\"06315d7bde65bf8117757861f6675111\", 4, 128, 4, 128, 768, 30522, 768]", "cuda -keys=cuda,gpu -max_num_threads=1024 -thread_warp_size=32", [-1, 16, 64, 49152, 2147483647, 1024, 8, 32], "", 0, []], [[], [["CI", 4], ["CI", 2], ["CI", 1], ["FU", 5, [0, 1]], ["SP", 5, 0, 23440896, [64], 1], ["AN", 5, 0, 5], ["AN", 5, 1, 6], ["PR", 5, 0, "auto_unroll_max_step$512"]]]], "r": [[0.011617], 0, 2.01922, 1619655743], "v": "v0.6"}
{"i": [["[\"06315d7bde65bf8117757861f6675111\", 8, 128, 8, 128, 768, 30522, 768]", "cuda -keys=cuda,gpu -max_num_threads=1024 -thread_warp_size=32", [-1, 16, 64, 49152, 2147483647, 1024, 8, 32], "", 0, []], [[], [["CI", 4], ["CI", 2], ["CI", 1], ["FU", 5, [0, 1]], ["SP", 5, 0, 23440896, [64], 1], ["AN", 5, 0, 5], ["AN", 5, 1, 6], ["PR", 5, 0, "auto_unroll_max_step$64"]]]], "r": [[0.0232189], 0, 2.10787, 1619656380], "v": "v0.6"}
{"i": [["[\"06315d7bde65bf8117757861f6675111\", 16, 128, 16, 128, 768, 30522, 768]", "cuda -keys=cuda,gpu -max_num_threads=1024 -thread_warp_size=32", [-1, 16, 64, 49152, 2147483647, 1024, 8, 32], "", 0, []], [[], [["FU", 5, [2, 3]], ["SP", 5, 2, 2048, [64], 1], ["AN", 5, 3, 6], ["CI", 4], ["CI", 2], ["CI", 1], ["FU", 5, [0, 1]], ["AN", 5, 0, 5], ["PR", 5, 0, "auto_unroll_max_step$0"]]]], "r": [[0.0406867], 0, 2.17324, 1619660397], "v": "v0.6"}
{"i": [["[\"06315d7bde65bf8117757861f6675111\", 32, 128, 32, 128, 768, 30522, 768]", "cuda -keys=cuda,gpu -max_num_threads=1024 -thread_warp_size=32", [-1, 16, 64, 49152, 2147483647, 1024, 8, 32], "", 0, []], [[], [["FU", 5, [2, 3]], ["SP", 5, 2, 4096, [64], 1], ["AN", 5, 3, 6], ["CI", 4], ["CI", 2], ["CI", 1], ["FU", 5, [0, 1]], ["AN", 5, 0, 5], ["PR", 5, 0, "auto_unroll_max_step$512"]]]], "r": [[0.0829905], 0, 2.50186, 1619659931], "v": "v0.6"}
{"i": [["[\"06315d7bde65bf8117757861f6675111\", 64, 128, 64, 128, 768, 30522, 768]", "cuda -keys=cuda,gpu -max_num_threads=1024 -thread_warp_size=32", [-1, 16, 64, 49152, 2147483647, 1024, 8, 32], "", 0, []], [[], [["FU", 5, [2, 3]], ["SP", 5, 2, 8192, [64], 1], ["AN", 5, 3, 6], ["CI", 4], ["CI", 2], ["CI", 1], ["FU", 5, [0, 1]], ["AN", 5, 0, 5], ["PR", 5, 0, "auto_unroll_max_step$0"]]]], "r": [[0.163033], 0, 2.42606, 1619659308], "v": "v0.6"}
{"i": [["[\"bc88a5af007477f9f16dc9f362878eea\", 1, 128, 1, 128, 768, 50257, 768]", "cuda -keys=cuda,gpu -max_num_threads=1024 -thread_warp_size=32", [-1, 16, 64, 49152, 2147483647, 1024, 8, 32], "", 0, []], [[], [["CI", 4], ["CI", 2], ["CI", 1], ["FU", 5, [0, 1]], ["SP", 5, 0, 38597376, [64], 1], ["AN", 5, 0, 5], ["AN", 5, 1, 6], ["PR", 5, 0, "auto_unroll_max_step$0"]]]], "r": [[0.00398977], 0, 2.31612, 1619655208], "v": "v0.6"}
{"i": [["[\"bc88a5af007477f9f16dc9f362878eea\", 4, 128, 4, 128, 768, 50257, 768]", "cuda -keys=cuda,gpu -max_num_threads=1024 -thread_warp_size=32", [-1, 16, 64, 49152, 2147483647, 1024, 8, 32], "", 0, []], [[], [["CI", 4], ["CI", 2], ["CI", 1], ["FU", 5, [0, 1]], ["SP", 5, 0, 38597376, [64], 1], ["AN", 5, 0, 5], ["AN", 5, 1, 6], ["PR", 5, 0, "auto_unroll_max_step$0"]]]], "r": [[0.0191142], 0, 2.31989, 1619655908], "v": "v0.6"}
{"i": [["[\"bc88a5af007477f9f16dc9f362878eea\", 8, 128, 8, 128, 768, 50257, 768]", "cuda -keys=cuda,gpu -max_num_threads=1024 -thread_warp_size=32", [-1, 16, 64, 49152, 2147483647, 1024, 8, 32], "", 0, []], [[], [["CI", 4], ["CI", 2], ["CI", 1], ["FU", 5, [0, 1]], ["SP", 5, 0, 38597376, [64], 1], ["AN", 5, 0, 5], ["AN", 5, 1, 6], ["PR", 5, 0, "auto_unroll_max_step$0"]]]], "r": [[0.038204], 0, 3.16122, 1619656522], "v": "v0.6"}
{"i": [["[\"bc88a5af007477f9f16dc9f362878eea\", 16, 128, 16, 128, 768, 50257, 768]", "cuda -keys=cuda,gpu -max_num_threads=1024 -thread_warp_size=32", [-1, 16, 64, 49152, 2147483647, 1024, 8, 32], "", 0, []], [[], [["FU", 5, [2, 3]], ["SP", 5, 2, 2048, [64], 1], ["AN", 5, 3, 6], ["CI", 4], ["CI", 2], ["CI", 1], ["FU", 5, [0, 1]], ["AN", 5, 0, 5], ["PR", 5, 0, "auto_unroll_max_step$64"]]]], "r": [[0.0670147], 0, 2.70714, 1619660185], "v": "v0.6"}
{"i": [["[\"bc88a5af007477f9f16dc9f362878eea\", 32, 128, 32, 128, 768, 50257, 768]", "cuda -keys=cuda,gpu -max_num_threads=1024 -thread_warp_size=32", [-1, 16, 64, 49152, 2147483647, 1024, 8, 32], "", 0, []], [[], [["FU", 5, [2, 3]], ["SP", 5, 2, 4096, [64], 1], ["AN", 5, 3, 6], ["CI", 4], ["CI", 2], ["CI", 1], ["FU", 5, [0, 1]], ["AN", 5, 0, 5], ["PR", 5, 0, "auto_unroll_max_step$512"]]]], "r": [[0.136695], 0, 2.51168, 1619659630], "v": "v0.6"}
{"i": [["[\"bc88a5af007477f9f16dc9f362878eea\", 64, 128, 64, 128, 768, 50257, 768]", "cuda -keys=cuda,gpu -max_num_threads=1024 -thread_warp_size=32", [-1, 16, 64, 49152, 2147483647, 1024, 8, 32], "", 0, []], [[], [["FU", 5, [2, 3]], ["SP", 5, 2, 8192, [64], 1], ["AN", 5, 3, 6], ["CI", 4], ["CI", 2], ["CI", 1], ["FU", 5, [0, 1]], ["AN", 5, 0, 5], ["PR", 5, 0, "auto_unroll_max_step$64"]]]], "r": [[0.268366], 0, 3.17734, 1619658977], "v": "v0.6"}
{"i": [["[\"0e85757c5cbd0067bf783eb79ed79ca9\", 1, 12, 5, 5, 1, 12, 5, 5, 1, 12, 5, 5]", "cuda -keys=cuda,gpu -max_num_threads=1024 -thread_warp_size=32", [-1, 16, 64, 49152, 2147483647, 1024, 8, 32], "", 0, []], [[], [["CI", 4], ["CI", 2], ["FU", 5, [0, 1, 2, 3]], ["SP", 5, 0, 300, [48], 1], ["AN", 5, 0, 5], ["AN", 5, 1, 6], ["FU", 3, [0, 1, 2, 3]], ["SP", 3, 0, 60, [8], 1], ["AN", 3, 0, 5], ["AN", 3, 1, 6], ["PR", 3, 0, "auto_unroll_max_step$16"]]]], "r": [[5.41468e-06], 0, 2.38236, 1619661044], "v": "v0.6"}
{"i": [["[\"0e85757c5cbd0067bf783eb79ed79ca9\", 1, 12, 32, 32, 1, 12, 32, 32, 1, 12, 32, 32]", "cuda -keys=cuda,gpu -max_num_threads=1024 -thread_warp_size=32", [-1, 16, 64, 49152, 2147483647, 1024, 8, 32], "", 0, []], [[], [["CI", 4], ["CI", 2], ["FU", 5, [0, 1, 2, 3]], ["SP", 5, 0, 12288, [24], 1], ["AN", 5, 0, 5], ["AN", 5, 1, 6], ["FU", 3, [0, 1, 2, 3]], ["SP", 3, 0, 384, [1], 1], ["AN", 3, 0, 5], ["AN", 3, 1, 6], ["PR", 3, 0, "auto_unroll_max_step$1024"]]]], "r": [[5.41393e-06], 0, 2.35947, 1619661196], "v": "v0.6"}
{"i": [["[\"0e85757c5cbd0067bf783eb79ed79ca9\", 1, 12, 64, 64, 1, 12, 64, 64, 1, 12, 64, 64]", "cuda -keys=cuda,gpu -max_num_threads=1024 -thread_warp_size=32", [-1, 16, 64, 49152, 2147483647, 1024, 8, 32], "", 0, []], [[], [["CI", 4], ["SP", 5, 3, 64, [32], 1], ["AN", 5, 4, 6], ["FSP", 3, 4, 1, 1], ["AN", 3, 5, 6], ["CA", 3, 5, 2], ["CI", 2], ["FU", 5, [0, 1, 2]], ["AN", 5, 0, 5], ["PR", 3, 0, "auto_unroll_max_step$16"]]]], "r": [[2.92291e-06], 0, 2.29654, 1619661316], "v": "v0.6"}
{"i": [["[\"0e85757c5cbd0067bf783eb79ed79ca9\", 1, 12, 128, 128, 1, 12, 128, 128, 1, 12, 128, 128]", "cuda -keys=cuda,gpu -max_num_threads=1024 -thread_warp_size=32", [-1, 16, 64, 49152, 2147483647, 1024, 8, 32], "", 0, []], [[], [["CI", 4], ["SP", 5, 3, 128, [32], 1], ["AN", 5, 4, 6], ["FSP", 3, 4, 1, 1], ["AN", 3, 5, 6], ["CA", 3, 5, 2], ["CI", 2], ["FU", 5, [0, 1, 2]], ["AN", 5, 0, 5], ["PR", 3, 0, "auto_unroll_max_step$16"]]]], "r": [[4.00899e-06], 0, 1.71891, 1619661431], "v": "v0.6"}
{"i": [["[\"0e85757c5cbd0067bf783eb79ed79ca9\", 4, 12, 5, 5, 4, 12, 5, 5, 4, 12, 5, 5]", "cuda -keys=cuda,gpu -max_num_threads=1024 -thread_warp_size=32", [-1, 16, 64, 49152, 2147483647, 1024, 8, 32], "", 0, []], [[], [["CI", 4], ["CI", 2], ["FU", 5, [0, 1, 2, 3]], ["SP", 5, 0, 1200, [32], 1], ["AN", 5, 0, 5], ["AN", 5, 1, 6], ["FU", 3, [0, 1, 2, 3]], ["SP", 3, 0, 240, [32], 1], ["AN", 3, 0, 5], ["AN", 3, 1, 6], ["PR", 3, 0, "auto_unroll_max_step$16"]]]], "r": [[5.47949e-06], 0, 2.38411, 1619661656], "v": "v0.6"}
{"i": [["[\"0e85757c5cbd0067bf783eb79ed79ca9\", 4, 12, 32, 32, 4, 12, 32, 32, 4, 12, 32, 32]", "cuda -keys=cuda,gpu -max_num_threads=1024 -thread_warp_size=32", [-1, 16, 64, 49152, 2147483647, 1024, 8, 32], "", 0, []], [[], [["CI", 4], ["CI", 2], ["FU", 5, [0, 1, 2, 3]], ["SP", 5, 0, 49152, [64], 1], ["AN", 5, 0, 5], ["AN", 5, 1, 6], ["FU", 3, [0, 1, 2, 3]], ["SP", 3, 0, 1536, [2], 1], ["AN", 3, 0, 5], ["AN", 3, 1, 6], ["PR", 3, 0, "auto_unroll_max_step$0"]]]], "r": [[6.14619e-06], 0, 1.82613, 1619661775], "v": "v0.6"}
{"i": [["[\"0e85757c5cbd0067bf783eb79ed79ca9\", 4, 12, 64, 64, 4, 12, 64, 64, 4, 12, 64, 64]", "cuda -keys=cuda,gpu -max_num_threads=1024 -thread_warp_size=32", [-1, 16, 64, 49152, 2147483647, 1024, 8, 32], "", 0, []], [[], [["CI", 4], ["SP", 5, 3, 64, [32], 1], ["AN", 5, 4, 6], ["FSP", 3, 4, 1, 1], ["AN", 3, 5, 6], ["CA", 3, 5, 2], ["CI", 2], ["FU", 5, [0, 1, 2]], ["AN", 5, 0, 5], ["PR", 3, 0, "auto_unroll_max_step$0"]]]], "r": [[6.19911e-06], 0, 1.83733, 1619661825], "v": "v0.6"}
{"i": [["[\"0e85757c5cbd0067bf783eb79ed79ca9\", 4, 12, 128, 128, 4, 12, 128, 128, 4, 12, 128, 128]", "cuda -keys=cuda,gpu -max_num_threads=1024 -thread_warp_size=32", [-1, 16, 64, 49152, 2147483647, 1024, 8, 32], "", 0, []], [[], [["CI", 4], ["SP", 5, 3, 128, [32], 1], ["AN", 5, 4, 6], ["FSP", 3, 4, 1, 1], ["AN", 3, 5, 6], ["CA", 3, 5, 2], ["CI", 2], ["FU", 5, [0, 1, 2]], ["AN", 5, 0, 5], ["PR", 3, 0, "auto_unroll_max_step$0"]]]], "r": [[1.39837e-05], 0, 2.03398, 1619661951], "v": "v0.6"}
{"i": [["[\"0e85757c5cbd0067bf783eb79ed79ca9\", 8, 12, 5, 5, 8, 12, 5, 5, 8, 12, 5, 5]", "cuda -keys=cuda,gpu -max_num_threads=1024 -thread_warp_size=32", [-1, 16, 64, 49152, 2147483647, 1024, 8, 32], "", 0, []], [[], [["CI", 4], ["CI", 2], ["FU", 5, [0, 1, 2, 3]], ["SP", 5, 0, 2400, [32], 1], ["AN", 5, 0, 5], ["AN", 5, 1, 6], ["FU", 3, [0, 1, 2, 3]], ["SP", 3, 0, 480, [5], 1], ["AN", 3, 0, 5], ["AN", 3, 1, 6], ["PR", 3, 0, "auto_unroll_max_step$0"]]]], "r": [[5.45279e-06], 0, 2.44461, 1619662149], "v": "v0.6"}
{"i": [["[\"0e85757c5cbd0067bf783eb79ed79ca9\", 8, 12, 32, 32, 8, 12, 32, 32, 8, 12, 32, 32]", "cuda -keys=cuda,gpu -max_num_threads=1024 -thread_warp_size=32", [-1, 16, 64, 49152, 2147483647, 1024, 8, 32], "", 0, []], [[], [["CI", 4], ["CI", 2], ["FU", 5, [0, 1, 2, 3]], ["SP", 5, 0, 98304, [64], 1], ["AN", 5, 0, 5], ["AN", 5, 1, 6], ["FU", 3, [0, 1, 2, 3]], ["SP", 3, 0, 3072, [2], 1], ["AN", 3, 0, 5], ["AN", 3, 1, 6], ["PR", 3, 0, "auto_unroll_max_step$16"]]]], "r": [[8.28888e-06], 0, 1.95531, 1619662303], "v": "v0.6"}
{"i": [["[\"0e85757c5cbd0067bf783eb79ed79ca9\", 8, 12, 64, 64, 8, 12, 64, 64, 8, 12, 64, 64]", "cuda -keys=cuda,gpu -max_num_threads=1024 -thread_warp_size=32", [-1, 16, 64, 49152, 2147483647, 1024, 8, 32], "", 0, []], [[], [["CI", 4], ["SP", 5, 3, 64, [32], 1], ["AN", 5, 4, 6], ["FSP", 3, 4, 1, 1], ["AN", 3, 5, 6], ["CA", 3, 5, 2], ["CI", 2], ["FU", 5, [0, 1, 2]], ["AN", 5, 0, 5], ["PR", 3, 0, "auto_unroll_max_step$512"]]]], "r": [[1.0566e-05], 0, 1.92255, 1619662348], "v": "v0.6"}
{"i": [["[\"0e85757c5cbd0067bf783eb79ed79ca9\", 8, 12, 128, 128, 8, 12, 128, 128, 8, 12, 128, 128]", "cuda -keys=cuda,gpu -max_num_threads=1024 -thread_warp_size=32", [-1, 16, 64, 49152, 2147483647, 1024, 8, 32], "", 0, []], [[], [["CI", 4], ["SP", 5, 3, 128, [16], 1], ["AN", 5, 4, 6], ["FSP", 3, 4, 1, 1], ["AN", 3, 5, 6], ["CA", 3, 5, 2], ["CI", 2], ["FU", 5, [0, 1, 2]], ["AN", 5, 0, 5], ["PR", 3, 0, "auto_unroll_max_step$1024"]]]], "r": [[2.58261e-05], 0, 2.1665, 1619662493], "v": "v0.6"}
{"i": [["[\"0e85757c5cbd0067bf783eb79ed79ca9\", 16, 12, 5, 5, 16, 12, 5, 5, 16, 12, 5, 5]", "cuda -keys=cuda,gpu -max_num_threads=1024 -thread_warp_size=32", [-1, 16, 64, 49152, 2147483647, 1024, 8, 32], "", 0, []], [[], [["CI", 4], ["CI", 2], ["FU", 5, [0, 1, 2, 3]], ["SP", 5, 0, 4800, [24], 1], ["AN", 5, 0, 5], ["AN", 5, 1, 6], ["FU", 3, [0, 1, 2, 3]], ["SP", 3, 0, 960, [1], 1], ["AN", 3, 0, 5], ["AN", 3, 1, 6], ["PR", 3, 0, "auto_unroll_max_step$512"]]]], "r": [[5.44286e-06], 0, 1.78392, 1619662684], "v": "v0.6"}
{"i": [["[\"0e85757c5cbd0067bf783eb79ed79ca9\", 16, 12, 32, 32, 16, 12, 32, 32, 16, 12, 32, 32]", "cuda -keys=cuda,gpu -max_num_threads=1024 -thread_warp_size=32", [-1, 16, 64, 49152, 2147483647, 1024, 8, 32], "", 0, []], [[], [["CI", 4], ["CI", 2], ["FU", 5, [0, 1, 2, 3]], ["SP", 5, 0, 196608, [64], 1], ["AN", 5, 0, 5], ["AN", 5, 1, 6], ["FU", 3, [0, 1, 2, 3]], ["SP", 3, 0, 6144, [6], 1], ["AN", 3, 0, 5], ["AN", 3, 1, 6], ["PR", 3, 0, "auto_unroll_max_step$1024"]]]], "r": [[1.16361e-05], 0, 2.00613, 1619662847], "v": "v0.6"}
{"i": [["[\"0e85757c5cbd0067bf783eb79ed79ca9\", 16, 12, 64, 64, 16, 12, 64, 64, 16, 12, 64, 64]", "cuda -keys=cuda,gpu -max_num_threads=1024 -thread_warp_size=32", [-1, 16, 64, 49152, 2147483647, 1024, 8, 32], "", 0, []], [[], [["CI", 4], ["SP", 5, 3, 64, [32], 1], ["AN", 5, 4, 6], ["FSP", 3, 4, 1, 1], ["AN", 3, 5, 6], ["CA", 3, 5, 2], ["CI", 2], ["FU", 5, [0, 1, 2]], ["AN", 5, 0, 5], ["PR", 3, 0, "auto_unroll_max_step$64"]]]], "r": [[1.97901e-05], 0, 2.00844, 1619662891], "v": "v0.6"}
{"i": [["[\"0e85757c5cbd0067bf783eb79ed79ca9\", 16, 12, 128, 128, 16, 12, 128, 128, 16, 12, 128, 128]", "cuda -keys=cuda,gpu -max_num_threads=1024 -thread_warp_size=32", [-1, 16, 64, 49152, 2147483647, 1024, 8, 32], "", 0, []], [[], [["CI", 4], ["SP", 5, 3, 128, [16], 1], ["AN", 5, 4, 6], ["FSP", 3, 4, 1, 1], ["AN", 3, 5, 6], ["CA", 3, 5, 2], ["CI", 2], ["FU", 5, [0, 1, 2]], ["AN", 5, 0, 5], ["PR", 3, 0, "auto_unroll_max_step$64"]]]], "r": [[4.80561e-05], 0, 2.34359, 1619663048], "v": "v0.6"}
{"i": [["[\"0e85757c5cbd0067bf783eb79ed79ca9\", 32, 12, 5, 5, 32, 12, 5, 5, 32, 12, 5, 5]", "cuda -keys=cuda,gpu -max_num_threads=1024 -thread_warp_size=32", [-1, 16, 64, 49152, 2147483647, 1024, 8, 32], "", 0, []], [[], [["CI", 4], ["CI", 2], ["FU", 5, [0, 1, 2, 3]], ["SP", 5, 0, 9600, [32], 1], ["AN", 5, 0, 5], ["AN", 5, 1, 6], ["FU", 3, [0, 1, 2, 3]], ["SP", 3, 0, 1920, [5], 1], ["AN", 3, 0, 5], ["AN", 3, 1, 6], ["PR", 3, 0, "auto_unroll_max_step$16"]]]], "r": [[5.48103e-06], 0, 2.29206, 1619663188], "v": "v0.6"}
{"i": [["[\"0e85757c5cbd0067bf783eb79ed79ca9\", 32, 12, 32, 32, 32, 12, 32, 32, 32, 12, 32, 32]", "cuda -keys=cuda,gpu -max_num_threads=1024 -thread_warp_size=32", [-1, 16, 64, 49152, 2147483647, 1024, 8, 32], "", 0, []], [[], [["CI", 4], ["CI", 2], ["FU", 5, [0, 1, 2, 3]], ["SP", 5, 0, 393216, [64], 1], ["AN", 5, 0, 5], ["AN", 5, 1, 6], ["FU", 3, [0, 1, 2, 3]], ["SP", 3, 0, 12288, [8], 1], ["AN", 3, 0, 5], ["AN", 3, 1, 6], ["PR", 3, 0, "auto_unroll_max_step$0"]]]], "r": [[1.91259e-05], 0, 1.97312, 1619663396], "v": "v0.6"}
{"i": [["[\"0e85757c5cbd0067bf783eb79ed79ca9\", 32, 12, 64, 64, 32, 12, 64, 64, 32, 12, 64, 64]", "cuda -keys=cuda,gpu -max_num_threads=1024 -thread_warp_size=32", [-1, 16, 64, 49152, 2147483647, 1024, 8, 32], "", 0, []], [[], [["CI", 4], ["SP", 5, 3, 64, [16], 1], ["AN", 5, 4, 6], ["FSP", 3, 4, 1, 1], ["AN", 3, 5, 6], ["CA", 3, 5, 2], ["CI", 2], ["FU", 5, [0, 1, 2]], ["AN", 5, 0, 5], ["PR", 3, 0, "auto_unroll_max_step$1024"]]]], "r": [[3.72756e-05], 0, 2.20534, 1619663460], "v": "v0.6"}
{"i": [["[\"0e85757c5cbd0067bf783eb79ed79ca9\", 32, 12, 128, 128, 32, 12, 128, 128, 32, 12, 128, 128]", "cuda -keys=cuda,gpu -max_num_threads=1024 -thread_warp_size=32", [-1, 16, 64, 49152, 2147483647, 1024, 8, 32], "", 0, []], [[], [["CI", 4], ["SP", 5, 3, 128, [16], 1], ["AN", 5, 4, 6], ["FSP", 3, 4, 1, 1], ["AN", 3, 5, 6], ["CA", 3, 5, 2], ["CI", 2], ["FU", 5, [0, 1, 2]], ["AN", 5, 0, 5], ["PR", 3, 0, "auto_unroll_max_step$16"]]]], "r": [[9.28324e-05], 0, 2.51028, 1619663614], "v": "v0.6"}
{"i": [["[\"0e85757c5cbd0067bf783eb79ed79ca9\", 64, 12, 5, 5, 64, 12, 5, 5, 64, 12, 5, 5]", "cuda -keys=cuda,gpu -max_num_threads=1024 -thread_warp_size=32", [-1, 16, 64, 49152, 2147483647, 1024, 8, 32], "", 0, []], [[], [["CI", 4], ["CI", 2], ["FU", 5, [0, 1, 2, 3]], ["SP", 5, 0, 19200, [60], 1], ["AN", 5, 0, 5], ["AN", 5, 1, 6], ["FU", 3, [0, 1, 2, 3]], ["SP", 3, 0, 3840, [4], 1], ["AN", 3, 0, 5], ["AN", 3, 1, 6], ["PR", 3, 0, "auto_unroll_max_step$64"]]]], "r": [[5.47519e-06], 0, 1.65816, 1619663784], "v": "v0.6"}
{"i": [["[\"0e85757c5cbd0067bf783eb79ed79ca9\", 64, 12, 32, 32, 64, 12, 32, 32, 64, 12, 32, 32]", "cuda -keys=cuda,gpu -max_num_threads=1024 -thread_warp_size=32", [-1, 16, 64, 49152, 2147483647, 1024, 8, 32], "", 0, []], [[], [["CI", 4], ["CI", 2], ["FU", 5, [0, 1, 2, 3]], ["SP", 5, 0, 786432, [64], 1], ["AN", 5, 0, 5], ["AN", 5, 1, 6], ["FU", 3, [0, 1, 2, 3]], ["SP", 3, 0, 24576, [3], 1], ["AN", 3, 0, 5], ["AN", 3, 1, 6], ["PR", 3, 0, "auto_unroll_max_step$16"]]]], "r": [[3.69473e-05], 0, 2.01369, 1619663913], "v": "v0.6"}
{"i": [["[\"0e85757c5cbd0067bf783eb79ed79ca9\", 64, 12, 64, 64, 64, 12, 64, 64, 64, 12, 64, 64]", "cuda -keys=cuda,gpu -max_num_threads=1024 -thread_warp_size=32", [-1, 16, 64, 49152, 2147483647, 1024, 8, 32], "", 0, []], [[], [["CI", 4], ["SP", 5, 3, 64, [32], 1], ["AN", 5, 4, 6], ["FSP", 3, 4, 1, 1], ["AN", 3, 5, 6], ["CA", 3, 5, 2], ["CI", 2], ["FU", 5, [0, 1, 2]], ["AN", 5, 0, 5], ["PR", 3, 0, "auto_unroll_max_step$1024"]]]], "r": [[7.20088e-05], 0, 2.23026, 1619664036], "v": "v0.6"}
{"i": [["[\"0e85757c5cbd0067bf783eb79ed79ca9\", 64, 12, 128, 128, 64, 12, 128, 128, 64, 12, 128, 128]", "cuda -keys=cuda,gpu -max_num_threads=1024 -thread_warp_size=32", [-1, 16, 64, 49152, 2147483647, 1024, 8, 32], "", 0, []], [[], [["CI", 4], ["SP", 5, 3, 128, [32], 1], ["AN", 5, 4, 6], ["FSP", 3, 4, 1, 1], ["AN", 3, 5, 6], ["CA", 3, 5, 2], ["CI", 2], ["FU", 5, [0, 1, 2]], ["AN", 5, 0, 5], ["PR", 3, 0, "auto_unroll_max_step$1024"]]]], "r": [[0.000181679], 0, 3.12852, 1623896146], "v": "v0.6"}
{"i": [["[\"d1e917cc56f4c3213ea95f241e9e26f8\", 768, 1, 128, 768, 768, 1, 128, 768]", "cuda -keys=cuda,gpu -max_num_threads=1024 -thread_warp_size=32", [-1, 16, 64, 49152, 2147483647, 1024, 8, 32], "", 0, []], [[], [["CI", 15], ["CI", 13], ["CI", 12], ["CI", 11], ["CI", 10], ["CI", 9], ["SP", 16, 2, 768, [64], 1], ["AN", 16, 3, 6], ["FSP", 8, 3, 6, 1], ["AN", 8, 4, 6], ["CA", 8, 16, 1], ["CI", 7], ["CI", 6], ["CI", 5], ["CI", 4], ["FSP", 3, 3, 6, 1], ["AN", 3, 4, 6], ["CA", 3, 16, 1], ["CI", 1], ["FU", 16, [0, 1]], ["AN", 16, 0, 5], ["PR", 3, 0, "auto_unroll_max_step$16"], ["PR", 8, 0, "auto_unroll_max_step$1024"]]]], "r": [[8.17007e-06], 0, 2.00686, 1619665191], "v": "v0.6"}
{"i": [["[\"d1e917cc56f4c3213ea95f241e9e26f8\", 768, 4, 128, 768, 768, 4, 128, 768]", "cuda -keys=cuda,gpu -max_num_threads=1024 -thread_warp_size=32", [-1, 16, 64, 49152, 2147483647, 1024, 8, 32], "", 0, []], [[], [["CI", 15], ["CI", 13], ["CI", 12], ["CI", 11], ["CI", 10], ["CI", 9], ["SP", 16, 2, 768, [32], 1], ["AN", 16, 3, 6], ["FSP", 8, 3, 6, 1], ["AN", 8, 4, 6], ["CA", 8, 16, 1], ["CI", 7], ["CI", 6], ["CI", 5], ["CI", 4], ["CI", 1], ["FU", 16, [0, 1]], ["AN", 16, 0, 5], ["FU", 3, [0, 1, 2]], ["SP", 3, 0, 512, [32], 1], ["AN", 3, 0, 5], ["AN", 3, 1, 6], ["PR", 3, 0, "auto_unroll_max_step$1024"], ["PR", 8, 0, "auto_unroll_max_step$0"]]]], "r": [[4.04265e-05], 0, 2.04206, 1619665483], "v": "v0.6"}
{"i": [["[\"d1e917cc56f4c3213ea95f241e9e26f8\", 768, 8, 128, 768, 768, 8, 128, 768]", "cuda -keys=cuda,gpu -max_num_threads=1024 -thread_warp_size=32", [-1, 16, 64, 49152, 2147483647, 1024, 8, 32], "", 0, []], [[], [["CI", 15], ["CI", 13], ["CI", 12], ["CI", 11], ["CI", 10], ["CI", 9], ["SP", 16, 2, 768, [64], 1], ["AN", 16, 3, 6], ["FSP", 8, 3, 6, 1], ["AN", 8, 4, 6], ["CA", 8, 16, 1], ["CI", 7], ["CI", 6], ["CI", 5], ["CI", 4], ["FSP", 3, 3, 6, 1], ["AN", 3, 4, 6], ["CA", 3, 16, 1], ["CI", 1], ["FU", 16, [0, 1]], ["AN", 16, 0, 5], ["PR", 3, 0, "auto_unroll_max_step$512"], ["PR", 8, 0, "auto_unroll_max_step$64"]]]], "r": [[1.42128e-05], 0, 2.13259, 1619665667], "v": "v0.6"}
{"i": [["[\"d1e917cc56f4c3213ea95f241e9e26f8\", 768, 16, 128, 768, 768, 16, 128, 768]", "cuda -keys=cuda,gpu -max_num_threads=1024 -thread_warp_size=32", [-1, 16, 64, 49152, 2147483647, 1024, 8, 32], "", 0, []], [[], [["CI", 15], ["CI", 13], ["CI", 12], ["CI", 11], ["CI", 10], ["CI", 9], ["SP", 16, 2, 768, [64], 1], ["AN", 16, 3, 6], ["FSP", 8, 3, 6, 1], ["AN", 8, 4, 6], ["CA", 8, 16, 1], ["CI", 7], ["CI", 6], ["CI", 5], ["CI", 4], ["FSP", 3, 3, 6, 1], ["AN", 3, 4, 6], ["CA", 3, 16, 1], ["CI", 1], ["FU", 16, [0, 1]], ["AN", 16, 0, 5], ["PR", 3, 0, "auto_unroll_max_step$64"], ["PR", 8, 0, "auto_unroll_max_step$512"]]]], "r": [[3.3189e-05], 0, 2.31133, 1619665881], "v": "v0.6"}
{"i": [["[\"d1e917cc56f4c3213ea95f241e9e26f8\", 768, 32, 128, 768, 768, 32, 128, 768]", "cuda -keys=cuda,gpu -max_num_threads=1024 -thread_warp_size=32", [-1, 16, 64, 49152, 2147483647, 1024, 8, 32], "", 0, []], [[], [["CI", 15], ["CI", 13], ["CI", 12], ["CI", 11], ["CI", 10], ["CI", 9], ["SP", 16, 2, 768, [64], 1], ["AN", 16, 3, 6], ["FSP", 8, 3, 6, 1], ["AN", 8, 4, 6], ["CA", 8, 16, 1], ["CI", 7], ["CI", 6], ["CI", 5], ["CI", 4], ["FSP", 3, 3, 6, 1], ["AN", 3, 4, 6], ["CA", 3, 16, 1], ["CI", 1], ["FU", 16, [0, 1]], ["AN", 16, 0, 5], ["PR", 3, 0, "auto_unroll_max_step$1024"], ["PR", 8, 0, "auto_unroll_max_step$16"]]]], "r": [[5.43542e-05], 0, 2.31306, 1619666135], "v": "v0.6"}
{"i": [["[\"d1e917cc56f4c3213ea95f241e9e26f8\", 768, 64, 128, 768, 768, 64, 128, 768]", "cuda -keys=cuda,gpu -max_num_threads=1024 -thread_warp_size=32", [-1, 16, 64, 49152, 2147483647, 1024, 8, 32], "", 0, []], [[], [["CI", 15], ["CI", 13], ["CI", 12], ["CI", 11], ["CI", 10], ["CI", 9], ["SP", 16, 2, 768, [64], 1], ["AN", 16, 3, 6], ["FSP", 8, 3, 6, 1], ["AN", 8, 4, 6], ["CA", 8, 16, 1], ["CI", 7], ["CI", 6], ["CI", 5], ["CI", 4], ["FSP", 3, 3, 6, 1], ["AN", 3, 4, 6], ["CA", 3, 16, 1], ["CI", 1], ["FU", 16, [0, 1]], ["AN", 16, 0, 5], ["PR", 3, 0, "auto_unroll_max_step$16"], ["PR", 8, 0, "auto_unroll_max_step$1024"]]]], "r": [[7.70202e-05], 0, 2.80809, 1623895338], "v": "v0.6"}
{"i": [["[\"5529e9f2bf3cbf8b3f3dae4b3276e14d\", 768, 1, 128, 768, 768, 1, 128, 768]", "cuda -keys=cuda,gpu -max_num_threads=1024 -thread_warp_size=32", [-1, 16, 64, 49152, 2147483647, 1024, 8, 32], "", 0, []], [[], [["CI", 15], ["CI", 13], ["CI", 12], ["CI", 11], ["CI", 10], ["CI", 9], ["SP", 16, 2, 768, [64], 1], ["AN", 16, 3, 6], ["FSP", 8, 3, 6, 1], ["AN", 8, 4, 6], ["CA", 8, 16, 1], ["CI", 7], ["CI", 6], ["CI", 5], ["CI", 4], ["FSP", 3, 3, 6, 1], ["AN", 3, 4, 6], ["CA", 3, 16, 1], ["CI", 1], ["FU", 16, [0, 1]], ["AN", 16, 0, 5], ["PR", 3, 0, "auto_unroll_max_step$64"], ["PR", 8, 0, "auto_unroll_max_step$1024"]]]], "r": [[8.18105e-06], 0, 2.02009, 1619665272], "v": "v0.6"}
{"i": [["[\"5529e9f2bf3cbf8b3f3dae4b3276e14d\", 768, 4, 128, 768, 768, 4, 128, 768]", "cuda -keys=cuda,gpu -max_num_threads=1024 -thread_warp_size=32", [-1, 16, 64, 49152, 2147483647, 1024, 8, 32], "", 0, []], [[], [["CI", 15], ["CI", 13], ["CI", 12], ["CI", 11], ["CI", 10], ["CI", 9], ["SP", 16, 2, 768, [64], 1], ["AN", 16, 3, 6], ["FSP", 8, 3, 6, 1], ["AN", 8, 4, 6], ["CA", 8, 16, 1], ["CI", 7], ["CI", 6], ["CI", 5], ["CI", 4], ["FSP", 3, 3, 6, 1], ["AN", 3, 4, 6], ["CA", 3, 16, 1], ["CI", 1], ["FU", 16, [0, 1]], ["AN", 16, 0, 5], ["PR", 3, 0, "auto_unroll_max_step$512"], ["PR", 8, 0, "auto_unroll_max_step$512"]]]], "r": [[9.75872e-06], 0, 2.02985, 1619665601], "v": "v0.6"}
{"i": [["[\"5529e9f2bf3cbf8b3f3dae4b3276e14d\", 768, 8, 128, 768, 768, 8, 128, 768]", "cuda -keys=cuda,gpu -max_num_threads=1024 -thread_warp_size=32", [-1, 16, 64, 49152, 2147483647, 1024, 8, 32], "", 0, []], [[], [["CI", 15], ["CI", 13], ["CI", 12], ["CI", 11], ["CI", 10], ["CI", 9], ["SP", 16, 2, 768, [64], 1], ["AN", 16, 3, 6], ["FSP", 8, 3, 6, 1], ["AN", 8, 4, 6], ["CA", 8, 16, 1], ["CI", 7], ["CI", 6], ["CI", 5], ["CI", 4], ["FSP", 3, 3, 6, 1], ["AN", 3, 4, 6], ["CA", 3, 16, 1], ["CI", 1], ["FU", 16, [0, 1]], ["AN", 16, 0, 5], ["PR", 3, 0, "auto_unroll_max_step$64"], ["PR", 8, 0, "auto_unroll_max_step$1024"]]]], "r": [[1.42056e-05], 0, 2.17863, 1619665835], "v": "v0.6"}
{"i": [["[\"5529e9f2bf3cbf8b3f3dae4b3276e14d\", 768, 16, 128, 768, 768, 16, 128, 768]", "cuda -keys=cuda,gpu -max_num_threads=1024 -thread_warp_size=32", [-1, 16, 64, 49152, 2147483647, 1024, 8, 32], "", 0, []], [[], [["CI", 15], ["CI", 13], ["CI", 12], ["CI", 11], ["CI", 10], ["CI", 9], ["SP", 16, 2, 768, [64], 1], ["AN", 16, 3, 6], ["FSP", 8, 3, 6, 1], ["AN", 8, 4, 6], ["CA", 8, 16, 1], ["CI", 7], ["CI", 6], ["CI", 5], ["CI", 4], ["FSP", 3, 3, 6, 1], ["AN", 3, 4, 6], ["CA", 3, 16, 1], ["CI", 1], ["FU", 16, [0, 1]], ["AN", 16, 0, 5], ["PR", 3, 0, "auto_unroll_max_step$64"], ["PR", 8, 0, "auto_unroll_max_step$1024"]]]], "r": [[3.31923e-05], 0, 2.2818, 1619666073], "v": "v0.6"}
{"i": [["[\"5529e9f2bf3cbf8b3f3dae4b3276e14d\", 768, 32, 128, 768, 768, 32, 128, 768]", "cuda -keys=cuda,gpu -max_num_threads=1024 -thread_warp_size=32", [-1, 16, 64, 49152, 2147483647, 1024, 8, 32], "", 0, []], [[], [["CI", 15], ["CI", 13], ["CI", 12], ["CI", 11], ["CI", 10], ["CI", 9], ["SP", 16, 2, 768, [64], 1], ["AN", 16, 3, 6], ["FSP", 8, 3, 6, 1], ["AN", 8, 4, 6], ["CA", 8, 16, 1], ["CI", 7], ["CI", 6], ["CI", 5], ["CI", 4], ["FSP", 3, 3, 6, 1], ["AN", 3, 4, 6], ["CA", 3, 16, 1], ["CI", 1], ["FU", 16, [0, 1]], ["AN", 16, 0, 5], ["PR", 3, 0, "auto_unroll_max_step$1024"], ["PR", 8, 0, "auto_unroll_max_step$16"]]]], "r": [[5.43534e-05], 0, 2.27768, 1619666341], "v": "v0.6"}
{"i": [["[\"5529e9f2bf3cbf8b3f3dae4b3276e14d\", 768, 64, 128, 768, 768, 64, 128, 768]", "cuda -keys=cuda,gpu -max_num_threads=1024 -thread_warp_size=32", [-1, 16, 64, 49152, 2147483647, 1024, 8, 32], "", 0, []], [[], [["CI", 15], ["CI", 13], ["CI", 12], ["CI", 11], ["CI", 10], ["CI", 9], ["SP", 16, 2, 768, [64], 1], ["AN", 16, 3, 6], ["FSP", 8, 3, 6, 1], ["AN", 8, 4, 6], ["CA", 8, 16, 1], ["CI", 7], ["CI", 6], ["CI", 5], ["CI", 4], ["FSP", 3, 3, 6, 1], ["AN", 3, 4, 6], ["CA", 3, 16, 1], ["CI", 1], ["FU", 16, [0, 1]], ["AN", 16, 0, 5], ["PR", 3, 0, "auto_unroll_max_step$64"], ["PR", 8, 0, "auto_unroll_max_step$64"]]]], "r": [[7.70646e-05], 0, 3.69612, 1623891415], "v": "v0.6"}
{"i": [["[\"2f7cd58b3725ec7e0639d86e2fe896f9\", 1, 128, 768, 1, 128, 768, 768, 1, 128, 768, 768, 768]", "cuda -keys=cuda,gpu -max_num_threads=1024 -thread_warp_size=32", [-1, 16, 64, 49152, 2147483647, 1024, 8, 32], "", 0, []], [[], [["FU", 28, [1, 2]], ["SP", 28, 1, 128, [32], 1], ["AN", 28, 2, 6], ["FU", 27, [1, 2]], ["SP", 27, 1, 128, [64], 1], ["AN", 27, 2, 6], ["CI", 26], ["CI", 25], ["CI", 24], ["CI", 22], ["CI", 21], ["SP", 23, 2, 768, [64], 1], ["AN", 23, 3, 6], ["FSP", 20, 3, 11, 1], ["AN", 20, 4, 6], ["CA", 20, 23, 1], ["CI", 19], ["CI", 18], ["CI", 17], ["CI", 16], ["CI", 15], ["FSP", 14, 3, 11, 1], ["AN", 14, 4, 6], ["CA", 14, 23, 1], ["CI", 13], ["CI", 12], ["CI", 10], ["CI", 9], ["CI", 8], ["CI", 7], ["SP", 6, 3, 768, [64], 1], ["AN", 6, 4, 6], ["CI", 5], ["CI", 4], ["CI", 3], ["SP", 2, 3, 768, [32], 1], ["AN", 2, 4, 6], ["AN", 28, 0, 5], ["AN", 27, 0, 5], ["FU", 23, [0, 1]], ["AN", 23, 0, 5], ["FU", 6, [0, 1, 2]], ["AN", 6, 0, 5], ["FU", 2, [0, 1, 2]], ["AN", 2, 0, 5], ["PR", 2, 0, "auto_unroll_max_step$16"], ["PR", 6, 0, "auto_unroll_max_step$0"], ["PR", 14, 0, "auto_unroll_max_step$0"], ["PR", 20, 0, "auto_unroll_max_step$0"], ["PR", 27, 0, "auto_unroll_max_step$512"], ["PR", 28, 0, "auto_unroll_max_step$1024"]]]], "r": [[3.08625e-05], 0, 2.5255, 1619667210], "v": "v0.6"}
{"i": [["[\"2f7cd58b3725ec7e0639d86e2fe896f9\", 4, 128, 768, 4, 128, 768, 768, 4, 128, 768, 768, 768]", "cuda -keys=cuda,gpu -max_num_threads=1024 -thread_warp_size=32", [-1, 16, 64, 49152, 2147483647, 1024, 8, 32], "", 0, []], [[], [["FU", 28, [1, 2]], ["SP", 28, 1, 512, [32], 1], ["AN", 28, 2, 6], ["FU", 27, [1, 2]], ["SP", 27, 1, 512, [32], 1], ["AN", 27, 2, 6], ["CI", 26], ["CI", 25], ["CI", 24], ["CI", 22], ["CI", 21], ["SP", 23, 2, 768, [32], 1], ["AN", 23, 3, 6], ["FSP", 20, 3, 11, 1], ["AN", 20, 4, 6], ["CA", 20, 23, 1], ["CI", 19], ["CI", 18], ["CI", 17], ["CI", 16], ["CI", 15], ["FSP", 14, 3, 11, 1], ["AN", 14, 4, 6], ["CA", 14, 23, 1], ["CI", 13], ["CI", 12], ["CI", 10], ["CI", 9], ["CI", 8], ["CI", 7], ["SP", 6, 3, 768, [32], 1], ["AN", 6, 4, 6], ["CI", 5], ["CI", 4], ["CI", 3], ["SP", 2, 3, 768, [32], 1], ["AN", 2, 4, 6], ["AN", 28, 0, 5], ["AN", 27, 0, 5], ["FU", 23, [0, 1]], ["AN", 23, 0, 5], ["FU", 6, [0, 1, 2]], ["AN", 6, 0, 5], ["FU", 2, [0, 1, 2]], ["AN", 2, 0, 5], ["PR", 2, 0, "auto_unroll_max_step$512"], ["PR", 6, 0, "auto_unroll_max_step$16"], ["PR", 14, 0, "auto_unroll_max_step$512"], ["PR", 20, 0, "auto_unroll_max_step$0"], ["PR", 27, 0, "auto_unroll_max_step$0"], ["PR", 28, 0, "auto_unroll_max_step$64"]]]], "r": [[6.39516e-05], 0, 2.22337, 1619667613], "v": "v0.6"}
{"i": [["[\"2f7cd58b3725ec7e0639d86e2fe896f9\", 8, 128, 768, 8, 128, 768, 768, 8, 128, 768, 768, 768]", "cuda -keys=cuda,gpu -max_num_threads=1024 -thread_warp_size=32", [-1, 16, 64, 49152, 2147483647, 1024, 8, 32], "", 0, []], [[], [["FU", 28, [1, 2]], ["SP", 28, 1, 1024, [32], 1], ["AN", 28, 2, 6], ["FU", 27, [1, 2]], ["SP", 27, 1, 1024, [32], 1], ["AN", 27, 2, 6], ["CI", 26], ["CI", 25], ["CI", 24], ["CI", 22], ["CI", 21], ["SP", 23, 2, 768, [8], 1], ["AN", 23, 3, 6], ["FSP", 20, 3, 11, 1], ["AN", 20, 4, 6], ["CA", 20, 23, 1], ["CI", 19], ["CI", 18], ["CI", 17], ["CI", 16], ["CI", 15], ["FSP", 14, 3, 11, 1], ["AN", 14, 4, 6], ["CA", 14, 23, 1], ["CI", 13], ["CI", 12], ["CI", 10], ["CI", 9], ["CI", 8], ["CI", 7], ["SP", 6, 3, 768, [64], 1], ["AN", 6, 4, 6], ["CI", 5], ["CI", 4], ["CI", 3], ["SP", 2, 3, 768, [64], 1], ["AN", 2, 4, 6], ["AN", 28, 0, 5], ["AN", 27, 0, 5], ["FU", 23, [0, 1]], ["AN", 23, 0, 5], ["FU", 6, [0, 1, 2]], ["AN", 6, 0, 5], ["FU", 2, [0, 1, 2]], ["AN", 2, 0, 5], ["PR", 2, 0, "auto_unroll_max_step$64"], ["PR", 6, 0, "auto_unroll_max_step$16"], ["PR", 14, 0, "auto_unroll_max_step$1024"], ["PR", 20, 0, "auto_unroll_max_step$16"], ["PR", 27, 0, "auto_unroll_max_step$0"], ["PR", 28, 0, "auto_unroll_max_step$1024"]]]], "r": [[0.000193092], 0, 2.80374, 1619667879], "v": "v0.6"}
{"i": [["[\"2f7cd58b3725ec7e0639d86e2fe896f9\", 16, 128, 768, 16, 128, 768, 768, 16, 128, 768, 768, 768]", "cuda -keys=cuda,gpu -max_num_threads=1024 -thread_warp_size=32", [-1, 16, 64, 49152, 2147483647, 1024, 8, 32], "", 0, []], [[], [["FU", 28, [1, 2]], ["SP", 28, 1, 2048, [32], 1], ["AN", 28, 2, 6], ["FU", 27, [1, 2]], ["SP", 27, 1, 2048, [32], 1], ["AN", 27, 2, 6], ["CI", 26], ["CI", 25], ["CI", 24], ["CI", 22], ["CI", 21], ["SP", 23, 2, 768, [32], 1], ["AN", 23, 3, 6], ["FSP", 20, 3, 11, 1], ["AN", 20, 4, 6], ["CA", 20, 23, 1], ["CI", 19], ["CI", 18], ["CI", 17], ["CI", 16], ["CI", 15], ["FSP", 14, 3, 11, 1], ["AN", 14, 4, 6], ["CA", 14, 23, 1], ["CI", 13], ["CI", 12], ["CI", 10], ["CI", 9], ["CI", 8], ["CI", 7], ["SP", 6, 3, 768, [32], 1], ["AN", 6, 4, 6], ["CI", 5], ["CI", 4], ["CI", 3], ["SP", 2, 3, 768, [32], 1], ["AN", 2, 4, 6], ["AN", 28, 0, 5], ["AN", 27, 0, 5], ["FU", 23, [0, 1]], ["AN", 23, 0, 5], ["FU", 6, [0, 1, 2]], ["AN", 6, 0, 5], ["FU", 2, [0, 1, 2]], ["AN", 2, 0, 5], ["PR", 2, 0, "auto_unroll_max_step$512"], ["PR", 6, 0, "auto_unroll_max_step$16"], ["PR", 14, 0, "auto_unroll_max_step$512"], ["PR", 20, 0, "auto_unroll_max_step$512"], ["PR", 27, 0, "auto_unroll_max_step$1024"], ["PR", 28, 0, "auto_unroll_max_step$1024"]]]], "r": [[0.000179466], 0, 2.60681, 1619668376], "v": "v0.6"}
{"i": [["[\"2f7cd58b3725ec7e0639d86e2fe896f9\", 32, 128, 768, 32, 128, 768, 768, 32, 128, 768, 768, 768]", "cuda -keys=cuda,gpu -max_num_threads=1024 -thread_warp_size=32", [-1, 16, 64, 49152, 2147483647, 1024, 8, 32], "", 0, []], [[], [["FU", 27, [1, 2]], ["SP", 27, 1, 4096, [64], 1], ["AN", 27, 2, 6], ["CI", 26], ["CI", 25], ["CI", 24], ["CI", 22], ["CI", 21], ["SP", 23, 2, 768, [64], 1], ["AN", 23, 3, 6], ["FSP", 20, 3, 8, 1], ["AN", 20, 4, 6], ["CA", 20, 23, 1], ["CI", 19], ["CI", 18], ["CI", 17], ["CI", 16], ["CI", 15], ["FSP", 14, 3, 8, 1], ["AN", 14, 4, 6], ["CA", 14, 23, 1], ["CI", 13], ["CI", 12], ["CI", 10], ["CI", 9], ["CI", 8], ["CI", 7], ["SP", 6, 3, 768, [32], 1], ["AN", 6, 4, 6], ["CI", 5], ["CI", 4], ["CI", 3], ["SP", 2, 3, 768, [8], 1], ["AN", 2, 4, 6], ["SP", 28, 0, 768, [64], 1], ["AN", 28, 0, 5], ["AN", 28, 1, 6], ["AN", 27, 0, 5], ["FU", 23, [0, 1]], ["AN", 23, 0, 5], ["FU", 6, [0, 1, 2]], ["AN", 6, 0, 5], ["FU", 2, [0, 1, 2]], ["AN", 2, 0, 5], ["PR", 2, 0, "auto_unroll_max_step$16"], ["PR", 6, 0, "auto_unroll_max_step$512"], ["PR", 14, 0, "auto_unroll_max_step$64"], ["PR", 20, 0, "auto_unroll_max_step$16"], ["PR", 27, 0, "auto_unroll_max_step$16"], ["PR", 28, 0, "auto_unroll_max_step$64"]]]], "r": [[0.000377831], 0, 2.66143, 1619668812], "v": "v0.6"}
{"i": [["[\"2f7cd58b3725ec7e0639d86e2fe896f9\", 64, 128, 768, 64, 128, 768, 768, 64, 128, 768, 768, 768]", "cuda -keys=cuda,gpu -max_num_threads=1024 -thread_warp_size=32", [-1, 16, 64, 49152, 2147483647, 1024, 8, 32], "", 0, []], [[], [["FU", 28, [1, 2]], ["SP", 28, 1, 8192, [16], 1], ["AN", 28, 2, 6], ["FU", 27, [1, 2]], ["SP", 27, 1, 8192, [32], 1], ["AN", 27, 2, 6], ["CI", 26], ["CI", 25], ["CI", 24], ["CI", 22], ["CI", 21], ["SP", 23, 2, 768, [64], 1], ["AN", 23, 3, 6], ["FSP", 20, 3, 11, 1], ["AN", 20, 4, 6], ["CA", 20, 23, 1], ["CI", 19], ["CI", 18], ["CI", 17], ["CI", 16], ["CI", 15], ["FSP", 14, 3, 11, 1], ["AN", 14, 4, 6], ["CA", 14, 23, 1], ["CI", 13], ["CI", 12], ["CI", 10], ["CI", 9], ["CI", 8], ["CI", 7], ["SP", 6, 3, 768, [32], 1], ["AN", 6, 4, 6], ["CI", 5], ["CI", 4], ["CI", 3], ["SP", 2, 3, 768, [64], 1], ["AN", 2, 4, 6], ["AN", 28, 0, 5], ["AN", 27, 0, 5], ["FU", 23, [0, 1]], ["AN", 23, 0, 5], ["FU", 6, [0, 1, 2]], ["AN", 6, 0, 5], ["FU", 2, [0, 1, 2]], ["AN", 2, 0, 5], ["PR", 2, 0, "auto_unroll_max_step$64"], ["PR", 6, 0, "auto_unroll_max_step$0"], ["PR", 14, 0, "auto_unroll_max_step$1024"], ["PR", 20, 0, "auto_unroll_max_step$1024"], ["PR", 27, 0, "auto_unroll_max_step$1024"], ["PR", 28, 0, "auto_unroll_max_step$0"]]]], "r": [[0.000541819], 0, 3.81529, 1625678548], "v": "v0.6"}
{"i": [["[\"3756fc21cbe9dc0a1597dccf8b55980b\", 1, 128, 768, 1, 128, 768, 768, 1, 128, 768, 768, 768]", "cuda -keys=cuda,gpu -max_num_threads=1024 -thread_warp_size=32", [-1, 16, 64, 49152, 2147483647, 1024, 8, 32], "", 0, []], [[], [["FU", 28, [1, 2]], ["SP", 28, 1, 128, [32], 1], ["AN", 28, 2, 6], ["FU", 27, [1, 2]], ["SP", 27, 1, 128, [64], 1], ["AN", 27, 2, 6], ["CI", 26], ["CI", 25], ["CI", 24], ["CI", 22], ["CI", 21], ["SP", 23, 2, 768, [32], 1], ["AN", 23, 3, 6], ["FSP", 20, 3, 11, 1], ["AN", 20, 4, 6], ["CA", 20, 23, 1], ["CI", 19], ["CI", 18], ["CI", 17], ["CI", 16], ["CI", 15], ["FSP", 14, 3, 11, 1], ["AN", 14, 4, 6], ["CA", 14, 23, 1], ["CI", 13], ["CI", 12], ["CI", 10], ["CI", 9], ["CI", 8], ["CI", 7], ["SP", 6, 3, 768, [64], 1], ["AN", 6, 4, 6], ["CI", 5], ["CI", 4], ["CI", 3], ["AN", 28, 0, 5], ["AN", 27, 0, 5], ["FU", 23, [0, 1]], ["AN", 23, 0, 5], ["FU", 6, [0, 1, 2]], ["AN", 6, 0, 5], ["FU", 2, [0, 1, 2]], ["SP", 2, 0, 128, [32], 1], ["AN", 2, 0, 5], ["AN", 2, 1, 6], ["PR", 2, 0, "auto_unroll_max_step$512"], ["PR", 6, 0, "auto_unroll_max_step$64"], ["PR", 14, 0, "auto_unroll_max_step$64"], ["PR", 20, 0, "auto_unroll_max_step$1024"], ["PR", 27, 0, "auto_unroll_max_step$1024"], ["PR", 28, 0, "auto_unroll_max_step$16"]]]], "r": [[5.84652e-05], 0, 2.47613, 1619667400], "v": "v0.6"}
{"i": [["[\"3756fc21cbe9dc0a1597dccf8b55980b\", 4, 128, 768, 4, 128, 768, 768, 4, 128, 768, 768, 768]", "cuda -keys=cuda,gpu -max_num_threads=1024 -thread_warp_size=32", [-1, 16, 64, 49152, 2147483647, 1024, 8, 32], "", 0, []], [[], [["FU", 28, [1, 2]], ["SP", 28, 1, 512, [64], 1], ["AN", 28, 2, 6], ["FU", 27, [1, 2]], ["SP", 27, 1, 512, [32], 1], ["AN", 27, 2, 6], ["CI", 26], ["CI", 25], ["CI", 24], ["CI", 22], ["CI", 21], ["SP", 23, 2, 768, [48], 1], ["AN", 23, 3, 6], ["FSP", 20, 3, 11, 1], ["AN", 20, 4, 6], ["CA", 20, 23, 1], ["CI", 19], ["CI", 18], ["CI", 17], ["CI", 16], ["CI", 15], ["FSP", 14, 3, 11, 1], ["AN", 14, 4, 6], ["CA", 14, 23, 1], ["CI", 13], ["CI", 12], ["CI", 10], ["CI", 9], ["CI", 8], ["CI", 7], ["SP", 6, 3, 768, [32], 1], ["AN", 6, 4, 6], ["CI", 5], ["CI", 4], ["CI", 3], ["SP", 2, 3, 768, [8], 1], ["AN", 2, 4, 6], ["AN", 28, 0, 5], ["AN", 27, 0, 5], ["FU", 23, [0, 1]], ["AN", 23, 0, 5], ["FU", 6, [0, 1, 2]], ["AN", 6, 0, 5], ["FU", 2, [0, 1, 2]], ["AN", 2, 0, 5], ["PR", 2, 0, "auto_unroll_max_step$512"], ["PR", 6, 0, "auto_unroll_max_step$16"], ["PR", 14, 0, "auto_unroll_max_step$512"], ["PR", 20, 0, "auto_unroll_max_step$0"], ["PR", 27, 0, "auto_unroll_max_step$512"], ["PR", 28, 0, "auto_unroll_max_step$1024"]]]], "r": [[5.87802e-05], 0, 2.35549, 1619667667], "v": "v0.6"}
{"i": [["[\"3756fc21cbe9dc0a1597dccf8b55980b\", 8, 128, 768, 8, 128, 768, 768, 8, 128, 768, 768, 768]", "cuda -keys=cuda,gpu -max_num_threads=1024 -thread_warp_size=32", [-1, 16, 64, 49152, 2147483647, 1024, 8, 32], "", 0, []], [[], [["FU", 28, [1, 2]], ["SP", 28, 1, 1024, [32], 1], ["AN", 28, 2, 6], ["FU", 27, [1, 2]], ["SP", 27, 1, 1024, [32], 1], ["AN", 27, 2, 6], ["CI", 26], ["CI", 25], ["CI", 24], ["CI", 22], ["CI", 21], ["SP", 23, 2, 768, [32], 1], ["AN", 23, 3, 6], ["FSP", 20, 3, 11, 1], ["AN", 20, 4, 6], ["CA", 20, 23, 1], ["CI", 19], ["CI", 18], ["CI", 17], ["CI", 16], ["CI", 15], ["FSP", 14, 3, 11, 1], ["AN", 14, 4, 6], ["CA", 14, 23, 1], ["CI", 13], ["CI", 12], ["CI", 10], ["CI", 9], ["CI", 8], ["CI", 7], ["SP", 6, 3, 768, [32], 1], ["AN", 6, 4, 6], ["CI", 5], ["CI", 4], ["CI", 3], ["SP", 2, 3, 768, [32], 1], ["AN", 2, 4, 6], ["AN", 28, 0, 5], ["AN", 27, 0, 5], ["FU", 23, [0, 1]], ["AN", 23, 0, 5], ["FU", 6, [0, 1, 2]], ["AN", 6, 0, 5], ["FU", 2, [0, 1, 2]], ["AN", 2, 0, 5], ["PR", 2, 0, "auto_unroll_max_step$1024"], ["PR", 6, 0, "auto_unroll_max_step$1024"], ["PR", 14, 0, "auto_unroll_max_step$0"], ["PR", 20, 0, "auto_unroll_max_step$512"], ["PR", 27, 0, "auto_unroll_max_step$16"], ["PR", 28, 0, "auto_unroll_max_step$64"]]]], "r": [[0.000100721], 0, 2.58382, 1619668194], "v": "v0.6"}
{"i": [["[\"3756fc21cbe9dc0a1597dccf8b55980b\", 16, 128, 768, 16, 128, 768, 768, 16, 128, 768, 768, 768]", "cuda -keys=cuda,gpu -max_num_threads=1024 -thread_warp_size=32", [-1, 16, 64, 49152, 2147483647, 1024, 8, 32], "", 0, []], [[], [["FU", 28, [1, 2]], ["SP", 28, 1, 2048, [32], 1], ["AN", 28, 2, 6], ["FU", 27, [1, 2]], ["SP", 27, 1, 2048, [32], 1], ["AN", 27, 2, 6], ["CI", 26], ["CI", 25], ["CI", 24], ["CI", 22], ["CI", 21], ["SP", 23, 2, 768, [64], 1], ["AN", 23, 3, 6], ["FSP", 20, 3, 11, 1], ["AN", 20, 4, 6], ["CA", 20, 23, 1], ["CI", 19], ["CI", 18], ["CI", 17], ["CI", 16], ["CI", 15], ["FSP", 14, 3, 11, 1], ["AN", 14, 4, 6], ["CA", 14, 23, 1], ["CI", 13], ["CI", 12], ["CI", 10], ["CI", 9], ["CI", 8], ["CI", 7], ["SP", 6, 3, 768, [64], 1], ["AN", 6, 4, 6], ["CI", 5], ["CI", 4], ["CI", 3], ["SP", 2, 3, 768, [64], 1], ["AN", 2, 4, 6], ["AN", 28, 0, 5], ["AN", 27, 0, 5], ["FU", 23, [0, 1]], ["AN", 23, 0, 5], ["FU", 6, [0, 1, 2]], ["AN", 6, 0, 5], ["FU", 2, [0, 1, 2]], ["AN", 2, 0, 5], ["PR", 2, 0, "auto_unroll_max_step$16"], ["PR", 6, 0, "auto_unroll_max_step$512"], ["PR", 14, 0, "auto_unroll_max_step$16"], ["PR", 20, 0, "auto_unroll_max_step$0"], ["PR", 27, 0, "auto_unroll_max_step$16"], ["PR", 28, 0, "auto_unroll_max_step$1024"]]]], "r": [[0.000165875], 0, 2.56052, 1619669878], "v": "v0.6"}
{"i": [["[\"3756fc21cbe9dc0a1597dccf8b55980b\", 32, 128, 768, 32, 128, 768, 768, 32, 128, 768, 768, 768]", "cuda -keys=cuda,gpu -max_num_threads=1024 -thread_warp_size=32", [-1, 16, 64, 49152, 2147483647, 1024, 8, 32], "", 0, []], [[], [["FU", 27, [1, 2]], ["SP", 27, 1, 4096, [64], 1], ["AN", 27, 2, 6], ["CI", 26], ["CI", 25], ["CI", 24], ["CI", 22], ["CI", 21], ["SP", 23, 2, 768, [64], 1], ["AN", 23, 3, 6], ["FSP", 20, 3, 8, 1], ["AN", 20, 4, 6], ["CA", 20, 23, 1], ["CI", 19], ["CI", 18], ["CI", 17], ["CI", 16], ["CI", 15], ["FSP", 14, 3, 8, 1], ["AN", 14, 4, 6], ["CA", 14, 23, 1], ["CI", 13], ["CI", 12], ["CI", 10], ["CI", 9], ["CI", 8], ["CI", 7], ["SP", 6, 3, 768, [64], 1], ["AN", 6, 4, 6], ["CI", 5], ["CI", 4], ["CI", 3], ["SP", 2, 3, 768, [32], 1], ["AN", 2, 4, 6], ["SP", 28, 0, 768, [4], 1], ["AN", 28, 0, 5], ["AN", 28, 1, 6], ["AN", 27, 0, 5], ["FU", 23, [0, 1]], ["AN", 23, 0, 5], ["FU", 6, [0, 1, 2]], ["AN", 6, 0, 5], ["FU", 2, [0, 1, 2]], ["AN", 2, 0, 5], ["PR", 2, 0, "auto_unroll_max_step$0"], ["PR", 6, 0, "auto_unroll_max_step$512"], ["PR", 14, 0, "auto_unroll_max_step$0"], ["PR", 20, 0, "auto_unroll_max_step$512"], ["PR", 27, 0, "auto_unroll_max_step$16"], ["PR", 28, 0, "auto_unroll_max_step$16"]]]], "r": [[0.000369901], 0, 2.61178, 1619668972], "v": "v0.6"}
